forum,title,authors,authorids,keywords,abstract,pdf,match,venue,year,type
https://openreview.net/forum?id=kUj9b2CezT,{'value': 'A Generative Approach for Treatment Effect Estimation under Collider Bias: From an Out-of-Distribution Perspective'},Baohong Li; Haoxuan Li; Anpeng Wu; Minqin Zhu; shiyuan Peng; Qingyu Cao; Kun Kuang,~Baohong_Li1; ~Haoxuan_Li6; ~Anpeng_Wu1; ~Minqin_Zhu1; ~shiyuan_Peng1; ~Qingyu_Cao1; ~Kun_Kuang1,,"{'value': 'Resulting from non-random sample selection caused by both the treatment and outcome, collider bias poses a unique challenge to treatment effect estimation using observational data whose distribution differs from that of the target population. In this paper, we rethink collider bias from an out-of-distribution (OOD) perspective, considering that the entire data space of the target population consists of two different environments: The observational data selected from the target population belongs to a seen environment labeled with $S=1$ and the missing unselected data belongs to another unseen environment labeled with $S=0$. Based on this OOD formulation, we utilize small-scale representative data from the entire data space with no environmental labels and propose a novel method, i.e., Coupled Counterfactual Generative Adversarial Model (C$^2$GAM), to simultaneously generate the missing $S=0$ samples in observational data and the missing $S$ labels in the small-scale representative data. With the help of C$^2$GAM, collider bias can be addressed by combining the generated $S=0$ samples and the observational data to estimate treatment effects. Extensive experiments on synthetic and real-world data demonstrate that plugging C$^2$GAM into existing treatment effect estimators achieves significant performance improvements.'}",https://openreview.net{'value': '/pdf/8275c9d5329dae1688108a7103fd4a7e8d610343.pdf'},{'abstract_filter': 'Synthetic'},ICML.cc,2024,Conference
https://openreview.net/forum?id=kKWjZoaRLv,{'value': 'Learning Latent Structures in Network Games via Data-Dependent Gated-Prior Graph Variational Autoencoders'},Xue Yu; Muchen Li; Yan Leng; Renjie Liao,~Xue_Yu2; ~Muchen_Li1; ~Yan_Leng1; ~Renjie_Liao1,,"{'value': 'In network games, individuals interact strategically within network environments to maximize their utilities. However, obtaining network structures is challenging. In this work, we propose an unsupervised learning model, called data-dependent gated-prior graph variational autoencoder (GPGVAE), that infers the underlying latent interaction type (strategic complement vs. substitute) among individuals and the latent network structure based on their observed actions. Specially, we propose a spectral graph neural network (GNN) based encoder to predict the interaction type and a data-dependent gated prior that models network structures conditioned on the interaction type. We further propose a Transformer based mixture of Bernoulli encoder of network structures and a GNN based decoder of game actions. We systematically study the Monte Carlo gradient estimation methods and effectively train our model in a stage-wise fashion. Extensive experiments across various synthetic and real-world network games demonstrate that our model achieves state-of-the-art performances in inferring network structures and well captures interaction types.'}",https://openreview.net{'value': '/pdf/19f55ea211446b319e7472e14bac0b5682666284.pdf'},{'abstract_filter': 'Synthetic'},ICML.cc,2024,Conference
https://openreview.net/forum?id=kIh7GJmRfD,{'value': 'ATraDiff: Accelerating Online Reinforcement Learning with Imaginary Trajectories'},Qianlan Yang; Yu-Xiong Wang,~Qianlan_Yang1; ~Yu-Xiong_Wang1,,"{'value': 'Training autonomous agents with sparse rewards is a long-standing problem in online reinforcement learning (RL), due to low data efficiency. Prior work overcomes this challenge by extracting useful knowledge from offline data, often accomplished through the learning of action distribution from offline data and utilizing the learned distribution to facilitate online RL. However, since the offline data are given and fixed, the extracted knowledge is inherently limited, making it difficult to generalize to new tasks. We propose a novel approach that leverages offline data to learn a generative diffusion model, coined as Adaptive Trajectory Diffuser (ATraDiff). This model generates synthetic trajectories, serving as a form of data augmentation and consequently enhancing the performance of online RL methods. The key strength of our diffuser lies in its adaptability, allowing it to effectively handle varying trajectory lengths and mitigate distribution shifts between online and offline data. Because of its simplicity, ATraDiff seamlessly integrates with a wide spectrum of RL methods. Empirical evaluation shows that ATraDiff consistently achieves state-of-the-art performance across a variety of environments, with particularly pronounced improvements in complicated settings. Our code and demo video are available at https://atradiff.github.io.'}",https://openreview.net{'value': '/pdf/4e43b8a7cd7fc5e0e8936bc770687d8a3a8e4df9.pdf'},{'title_filter': 'Trajectory'},ICML.cc,2024,Conference
https://openreview.net/forum?id=k2dVVIWWho,{'value': 'Differentially Private Decentralized Learning with Random Walks'},Edwige Cyffers; Aurélien Bellet; Jalaj Upadhyay,~Edwige_Cyffers1; ~Aurélien_Bellet1; ~Jalaj_Upadhyay1,,"{'value': 'The popularity of federated learning comes from the possibility of better scalability and the ability for participants to keep control of their data, improving data security and sovereignty. Unfortunately, sharing model updates also creates a new privacy attack surface. In this work, we characterize the privacy guarantees of decentralized learning with random walk algorithms, where a model is updated by traveling from one node to another along the edges of a communication graph. Using a recent variant of differential privacy tailored to the study of decentralized algorithms, namely Pairwise Network Differential Privacy, we derive closed-form expressions for the privacy loss between each pair of nodes where the impact of the communication topology is captured by graph theoretic quantities. Our results further reveal that random walk algorithms tends to yield better privacy guarantees than gossip algorithms for nodes close from each other. We supplement our theoretical results with empirical evaluation on synthetic and real-world graphs and datasets.'}",https://openreview.net{'value': '/pdf/9458ba6d072dc64e0045728db7d06bd3d2001d38.pdf'},{'abstract_filter': 'Synthetic'},ICML.cc,2024,Conference
https://openreview.net/forum?id=jzHmElqpPe,{'value': 'Position: Foundation Agents as the Paradigm Shift for Decision Making'},Xiaoqian Liu; Xingzhou Lou; Jianbin Jiao; Junge Zhang,~Xiaoqian_Liu1; ~Xingzhou_Lou1; ~Jianbin_Jiao1; ~Junge_Zhang1,,"{'value': 'Decision making demands intricate interplay between perception, memory, and reasoning to discern optimal policies. Conventional approaches to decision making face challenges related to low sample efficiency and poor generalization. In contrast, foundation models in language and vision have showcased rapid adaptation to diverse new tasks. Therefore, we advocate for the construction of foundation agents as a transformative shift in the learning paradigm of agents. This proposal is underpinned by the formulation of foundation agents with their fundamental characteristics and challenges motivated by the success of large language models (LLMs). Moreover, we specify the roadmap of foundation agents from large interactive data collection or generation, to self-supervised pretraining and adaptation, and knowledge and value alignment with LLMs. Lastly, we pinpoint critical research questions derived from the formulation and delineate trends for foundation agents supported by real-world use cases, addressing both technical and theoretical aspects to propel the field towards a more comprehensive and impactful future.'}",https://openreview.net{'value': '/pdf/2b3ab2672ab57d9d750d82c29a5a74d006e1c76d.pdf'},{'title_filter': 'Agent'},ICML.cc,2024,Conference
https://openreview.net/forum?id=jw2f9v59g0,{'value': 'Data-free Distillation of Diffusion Models with Bootstrapping'},Jiatao Gu; Chen Wang; Shuangfei Zhai; Yizhe Zhang; Lingjie Liu; Joshua M. Susskind,~Jiatao_Gu1; ~Chen_Wang13; ~Shuangfei_Zhai3; ~Yizhe_Zhang2; ~Lingjie_Liu1; ~Joshua_M._Susskind1,,"{'value': 'Diffusion models have demonstrated great potential for generating diverse images. However, their performance often suffers from slow generation due to iterative denoising. Knowledge distillation has been recently proposed as a remedy which can reduce the number of inference steps to one or a few, without significant quality degradation. However, existing distillation methods either require significant amounts of offline computation for generating synthetic training data from the teacher model, or need to perform expensive online learning with the help of real data. In this work, we present a novel technique called BOOT, that overcomes these limitations with an efficient data-free distillation algorithm. The core idea is to learn a time-conditioned model that predicts the output of a pre-trained diffusion model teacher given any time-step. Such a model can be efficiently trained based on bootstrapping from two consecutive sampled steps. Furthermore, our method can be easily adapted to large-scale text-to-image diffusion models, which are challenging for previous methods given the fact that the training sets are often large and difficult to access. We demonstrate the effectiveness of our approach on several benchmark datasets in the DDIM setting, achieving comparable generation quality while being orders of magnitude faster than the diffusion teacher. The text-to-image results show that the proposed approach is able to handle highly complex distributions, shedding light on more efficient generative modeling.'}",https://openreview.net{'value': '/pdf/91ce5baf1cb9a852eaf8a1706470b91358790b4a.pdf'},{'abstract_filter': 'Synthetic'},ICML.cc,2024,Conference
https://openreview.net/forum?id=jnps5YwNlU,{'value': 'Efficient Precision and Recall Metrics for Assessing Generative Models using Hubness-aware Sampling'},Yuanbang Liang; Jing Wu; Yu-Kun Lai; Yipeng Qin,~Yuanbang_Liang1; ~Jing_Wu3; ~Yu-Kun_Lai1; ~Yipeng_Qin1,,"{'value': 'Despite impressive results, deep generative models require massive datasets for training, and as dataset size increases, effective evaluation metrics like precision and recall (P&R) become computationally infeasible on commodity hardware. In this paper, we address this challenge by proposing efficient P&R (eP&R) metrics that give almost identical results as the original P&R but with much lower computational costs. Specifically, we identify two redundancies in the original P&R: i) redundancy in ratio computation and ii) redundancy in manifold inside/outside identification. We find both can be effectively removed via hubness-aware sampling, which extracts representative elements from synthetic/real image samples based on their hubness values, i.e., the number of times a sample becomes a k-nearest neighbor to others in the feature space. Thanks to the insensitivity of hubness-aware sampling to exact k-nearest neighbor (k-NN) results, we further improve the efficiency of our eP&R metrics by using approximate k-NN methods. Extensive experiments show that our eP&R matches the original P&R but is far more efficient in time and space. Our code is available at: https://github.com/Byronliang8/Hubness_Precision_Recall'}",https://openreview.net{'value': '/pdf/d8ce439134690e4e1facc75c1866dbeafda52212.pdf'},{'abstract_filter': 'Synthetic'},ICML.cc,2024,Conference
https://openreview.net/forum?id=jn2iTJas6h,{'value': 'A decoder-only foundation model for time-series forecasting'},Abhimanyu Das; Weihao Kong; Rajat Sen; Yichen Zhou,~Abhimanyu_Das2; ~Weihao_Kong1; ~Rajat_Sen1; ~Yichen_Zhou3,,"{'value': 'Motivated by recent advances in large language models for Natural Language Processing (NLP), we design a time-series foundation model for forecasting whose out-of-the-box zero-shot performance on a variety of public datasets comes close to the accuracy of state-of-the-art supervised forecasting models for each individual dataset. Our model is based on pretraining a decoder style attention model with input patching, using a large time-series corpus comprising both real-world and synthetic datasets. Experiments on a diverse set of previously unseen forecasting datasets suggests that the model can yield accurate zero-shot forecasts across different domains, forecasting horizons and temporal granularities.'}",https://openreview.net{'value': '/pdf/3f1cd31c9960cda3f8a2c9f8ead1337fed4692b3.pdf'},{'abstract_filter': 'Synthetic'},ICML.cc,2024,Conference
https://openreview.net/forum?id=jJ9BoXAfFa,{'value': 'Executable Code Actions Elicit Better LLM Agents'},Xingyao Wang; Yangyi Chen; Lifan Yuan; Yizhe Zhang; Yunzhu Li; Hao Peng; Heng Ji,~Xingyao_Wang1; ~Yangyi_Chen1; ~Lifan_Yuan1; ~Yizhe_Zhang2; ~Yunzhu_Li1; ~Hao_Peng4; ~Heng_Ji3,,"{'value': ""Large Language Model (LLM) agents, capable of performing a broad range of actions, such as invoking tools and controlling robots, show great potential in tackling real-world challenges. LLM agents are typically prompted to produce actions by generating JSON or text in a pre-defined format, which is usually limited by constrained action space (e.g., the scope of pre-defined tools) and restricted flexibility (e.g., inability to compose multiple tools). This work proposes to use executable Python **code** to consolidate LLM agents' **act**ions into a unified action space (**CodeAct**). Integrated with a Python interpreter, CodeAct can execute code actions and dynamically revise prior actions or emit new actions upon new observations through multi-turn interactions. Our extensive analysis of 17 LLMs on API-Bank and a newly curated benchmark shows that CodeAct outperforms widely used alternatives (up to 20% higher success rate). The encouraging performance of CodeAct motivates us to build an open-source LLM agent that interacts with environments by executing interpretable code and collaborates with users using natural language. To this end, we collect an instruction-tuning dataset CodeActInstruct that consists of 7k multi-turn interactions using CodeAct. We show that it can be used with existing data to improve models in agent-oriented tasks without compromising their general capability. CodeActAgent, finetuned from Llama2 and Mistral, is integrated with Python interpreter and uniquely tailored to perform sophisticated tasks (e.g., model training) using existing libraries and autonomously self-debug.""}",https://openreview.net{'value': '/pdf/77201ef17d3ec7f9b7079d50149857895613a953.pdf'},{'title_filter': 'Agent'},ICML.cc,2024,Conference
https://openreview.net/forum?id=j4HtfTqr0f,{'value': 'MILP-FBGen: LP/MILP Instance Generation with Feasibility/Boundedness'},Yahong Zhang; Chenchen Fan; Donghui Chen; Congrui Li; Wenli Ouyang; Mingda Zhu; Junchi Yan,~Yahong_Zhang2; ~Chenchen_Fan1; ~Donghui_Chen2; ~Congrui_Li1; ~Wenli_Ouyang1; ~Mingda_Zhu1; ~Junchi_Yan2,,"{'value': 'Machine learning (ML) has been actively adopted in Linear Programming (LP) and Mixed-Integer Linear Programming (MILP), whose potential is hindered by instance scarcity. Current synthetic instance generation methods often fall short in closely mirroring the distribution of original datasets or ensuring the feasibility and boundedness of the generated data — a critical requirement for obtaining reliable supervised labels in model training. In this paper, we present a diffusion-based LP/MILP instance generative framework called MILP-FBGen. It strikes a balance between structural similarity and novelty while maintaining feasibility/boundedness via a meticulously designed structure-preserving generation module and a feasibility/boundedness-constrained sampling module. Our method shows superiority on two fronts: 1) preservation of key properties (hardness, feasibility, and boundedness) of LP/MILP instances, and 2) enhanced performance on downstream tasks. Extensive studies show two-fold superiority that our method ensures higher distributional similarity and 100% feasibility in both easy and hard datasets, surpassing current state-of-the-art techniques.'}",https://openreview.net{'value': '/pdf/141cbfacf7f503d546ad4bd63d9d056806a6e639.pdf'},{'abstract_filter': 'Synthetic'},ICML.cc,2024,Conference
https://openreview.net/forum?id=igRAPavrrS,{'value': 'Private Gradient Descent for Linear Regression: Tighter Error Bounds and Instance-Specific Uncertainty Estimation'},Gavin R Brown; Krishnamurthy Dj Dvijotham; Georgina Evans; Daogao Liu; Adam Smith; Abhradeep Guha Thakurta,~Gavin_R_Brown1; ~Krishnamurthy_Dj_Dvijotham1; ~Georgina_Evans1; ~Daogao_Liu1; ~Adam_Smith1; ~Abhradeep_Guha_Thakurta1,,"{'value': ""We provide an improved analysis of standard differentially private gradient descent for linear regression under the squared error loss. Under modest assumptions on the input, we characterize the distribution of the iterate at each time step. Our analysis leads to new results on the algorithm's accuracy: for a proper fixed choice of hyperparameters, the sample complexity depends only linearly on the dimension of the data. This matches the dimension-dependence of the (non-private) ordinary least squares estimator as well as that of recent private algorithms that rely on sophisticated adaptive gradient-clipping schemes (Varshney et al., 2022; Liu et al., 2023). Our analysis of the iterates' distribution also allows us to construct confidence intervals for the empirical optimizer which adapt automatically to the variance of the algorithm on a particular data set. We validate our theorems through experiments on synthetic data.""}",https://openreview.net{'value': '/pdf/8f7a658b1ffa3c0978047a28dacb450d7a6e86c7.pdf'},{'abstract_filter': 'Synthetic'},ICML.cc,2024,Conference
https://openreview.net/forum?id=idyUNsoZ75,{'value': 'Evaluating Model Bias Requires Characterizing its Mistakes'},Isabela Albuquerque; Jessica Schrouff; David Warde-Farley; Ali Taylan Cemgil; Sven Gowal; Olivia Wiles,~Isabela_Albuquerque1; ~Jessica_Schrouff1; ~David_Warde-Farley1; ~Ali_Taylan_Cemgil2; ~Sven_Gowal2; ~Olivia_Wiles1,,"{'value': ""The ability to properly benchmark model performance in the face of spurious correlations is important to both build better predictors and increase confidence that models are operating as intended. We demonstrate that characterizing (as opposed to simply quantifying) model mistakes across subgroups is pivotal to properly reflect model biases, which are ignored by standard metrics such as worst-group accuracy or accuracy gap. Inspired by the hypothesis testing framework, we introduce SkewSize, a principled and flexible metric that captures bias from mistakes in a model's predictions. It can be used in multi-class settings or generalised to the open vocabulary setting of generative models. SkewSize is an aggregation of the effect size of the interaction between two categorical variables: the spurious variable representing the bias attribute the model's prediction. We demonstrate the utility of SkewSize in multiple settings including: standard vision models trained on synthetic data, vision models trained on ImageNet, and large scale vision-and-language models from the BLIP-2 family. In each case, the proposed SkewSize is able to highlight biases not captured by other metrics, while also providing insights on the impact of recently proposed techniques, such as instruction tuning.""}",https://openreview.net{'value': '/pdf/23a8eb66f7a1180920204621fc50ca54fd3e5d02.pdf'},{'abstract_filter': 'Synthetic'},ICML.cc,2024,Conference
https://openreview.net/forum?id=iYYA5zDoCm,{'value': 'Locally Interdependent Multi-Agent MDP: Theoretical Framework for Decentralized Agents with Dynamic Dependencies'},Alex DeWeese; Guannan Qu,~Alex_DeWeese2; ~Guannan_Qu1,,"{'value': ""Many multi-agent systems in practice are decentralized and have dynamically varying dependencies. There has been a lack of attempts in the literature to analyze these systems theoretically. In this paper, we propose and theoretically analyze a decentralized model with dynamically varying dependencies called the Locally Interdependent Multi-Agent MDP. This model can represent problems in many disparate domains such as cooperative navigation, obstacle avoidance, and formation control. Despite the intractability that general partially observable multi-agent systems suffer from, we propose three closed-form policies that are theoretically near-optimal in this setting and can be scalable to compute and store. Consequentially, we reveal a fundamental property of Locally Interdependent Multi-Agent MDP's that the partially observable decentralized solution is exponentially close to the fully observable solution with respect to the visibility radius. We then discuss extensions of our closed-form policies to further improve tractability. We conclude by providing simulations to investigate some long horizon behaviors of our closed-form policies.""}",https://openreview.net{'value': '/pdf/2ca698fae033b701eab86103feedd12986df07a0.pdf'},{'title_filter': 'Agent'},ICML.cc,2024,Conference
https://openreview.net/forum?id=i0nVanexij,{'value': 'Self-Correcting Self-Consuming Loops for Generative Model Training'},Nate Gillman; Michael Freeman; Daksh Aggarwal; Chia-Hong HSU; Calvin Luo; Yonglong Tian; Chen Sun,~Nate_Gillman1; michael_freeman@alumni.brown.edu; ~Daksh_Aggarwal1; ~Chia-Hong_HSU1; ~Calvin_Luo2; ~Yonglong_Tian1; ~Chen_Sun1,,"{'value': ""As synthetic data becomes higher quality and proliferates on the internet, machine learning models are increasingly trained on a mix of human- and machine-generated data. Despite the successful stories of using synthetic data for representation learning, using synthetic data for generative model training creates ``self-consuming loops'' which may lead to training instability or even collapse, unless certain conditions are met. Our paper aims to stabilize self-consuming generative model training. Our theoretical results demonstrate that by introducing an idealized correction function, which maps a data point to be more likely under the true data distribution, self-consuming loops can be made *exponentially* more stable. We then propose self-correction functions, which rely on expert knowledge (e.g. the laws of physics programmed in a simulator), and aim to approximate the idealized corrector automatically and at scale. We empirically validate the effectiveness of self-correcting self-consuming loops on the challenging human motion synthesis task, and observe that it successfully avoids model collapse, even when the ratio of synthetic data to real data is as high as 100%.""}",https://openreview.net{'value': '/pdf/1c7a965d64c9ec6e0e3e5e273526db7e18151abb.pdf'},{'abstract_filter': 'Synthetic'},ICML.cc,2024,Conference
https://openreview.net/forum?id=hz8cFsdz7P,{'value': 'LLM and Simulation as Bilevel Optimizers: A New Paradigm to Advance Physical Scientific Discovery'},Pingchuan Ma; Tsun-Hsuan Wang; Minghao Guo; Zhiqing Sun; Joshua B. Tenenbaum; Daniela Rus; Chuang Gan; Wojciech Matusik,~Pingchuan_Ma3; ~Tsun-Hsuan_Wang2; ~Minghao_Guo1; ~Zhiqing_Sun1; ~Joshua_B._Tenenbaum1; ~Daniela_Rus1; ~Chuang_Gan1; ~Wojciech_Matusik2,,"{'value': ""Large Language Models have recently gained significant attention in scientific discovery for their extensive knowledge and advanced reasoning capabilities. However, they encounter challenges in effectively simulating observational feedback and grounding it with language to propel advancements in physical scientific discovery. Conversely, human scientists undertake scientific discovery by formulating hypotheses, conducting experiments, and revising theories through observational analysis. Inspired by this, we propose to enhance the knowledge-driven, abstract reasoning abilities of LLMs with the computational strength of simulations. We introduce Scientific Generative Agent (SGA), a bilevel optimization framework: LLMs act as knowledgeable and versatile thinkers, proposing scientific hypotheses and reason about discrete components, such as physics equations or molecule structures; meanwhile, simulations function as experimental platforms, providing observational feedback and optimizing via differentiability for continuous parts, such as physical parameters. We conduct extensive experiments to demonstrate our framework's efficacy in constitutive law discovery and molecular design, unveiling novel solutions that differ from conventional human expectations yet remain coherent upon analysis.""}",https://openreview.net{'value': '/pdf/8e1aee641dee0dc2d14eb58b4c9d0f25392e7047.pdf'},{'abstract_filter': 'Agent'},ICML.cc,2024,Conference
