forum,title,authors,authorids,keywords,abstract,pdf,match,venue,year,type
https://openreview.net/forum?id=WIaZFk02fI,{'value': 'An Empirical Study of Realized GNN Expressiveness'},Yanbo Wang; Muhan Zhang,~Yanbo_Wang2; ~Muhan_Zhang1,,"{'value': 'Research on the theoretical expressiveness of Graph Neural Networks (GNNs) has developed rapidly, and many methods have been proposed to enhance the expressiveness. However, most methods do not have a uniform expressiveness measure except for a few that strictly follow the $k$-dimensional Weisfeiler-Lehman ($k$-WL) test hierarchy, leading to difficulties in quantitatively comparing their expressiveness. Previous research has attempted to use datasets for measurement, but facing problems with difficulty (any model surpassing 1-WL has nearly 100% accuracy), granularity (models tend to be either 100% correct or near random guess), and scale (only several essentially different graphs involved). To address these limitations, we study the realized expressive power that a practical model instance can achieve using a novel expressiveness dataset, BREC, which poses greater difficulty (with up to 4-WL-indistinguishable graphs), finer granularity (enabling comparison of models between 1-WL and 3-WL), a larger scale (consisting of 800 1-WL-indistinguishable graphs that are non-isomorphic to each other). We synthetically test 23 models with higher-than-1-WL expressiveness on BREC. Our experiment gives the first thorough measurement of the realized expressiveness of those state-of-the-art beyond-1-WL GNN models and reveals the gap between theoretical and realized expressiveness. Dataset and evaluation codes are released at: https://github.com/GraphPKU/BREC.'}",https://openreview.net{'value': '/pdf/236bacd610237e46e4508c497c59169d676e4e70.pdf'},{'abstract_filter': 'Synthetic'},ICML.cc,2024,Conference
https://openreview.net/forum?id=WFyolnFZOR,{'value': 'Language Models as Science Tutors'},Alexis Chevalier; Jiayi Geng; Alexander Wettig; Howard Chen; Sebastian Mizera; Toni Annala; Max Aragon; Arturo Rodriguez Fanlo; Simon Frieder; Simon Machado; Akshara Prabhakar; Ellie Thieu; Jiachen T. Wang; Zirui Wang; Xindi Wu; Mengzhou Xia; Wenhan Xia; Jiatong Yu; Junjie Zhu; Zhiyong Ren; Sanjeev Arora; Danqi Chen,~Alexis_Chevalier1; ~Jiayi_Geng1; ~Alexander_Wettig1; ~Howard_Chen1; ~Sebastian_Mizera1; ~Toni_Annala1; ~Max_Aragon1; ~Arturo_Rodriguez_Fanlo1; ~Simon_Frieder1; ~Simon_Machado1; ~Akshara_Prabhakar1; elliethieu.amherst@gmail.com; ~Jiachen_T._Wang1; ~Zirui_Wang5; ~Xindi_Wu1; ~Mengzhou_Xia1; ~Wenhan_Xia1; ~Jiatong_Yu1; ~Junjie_Zhu4; ~Zhiyong_Ren1; ~Sanjeev_Arora1; ~Danqi_Chen1,,"{'value': 'NLP has recently made exciting progress toward training language models (LMs) with strong scientific problem-solving skills. However, model development has not focused on real-life use-cases of LMs for science, including applications in education that require processing long scientific documents. To address this, we introduce TutorEval and TutorChat. TutorEval is a diverse question-answering benchmark consisting of questions about long chapters from STEM textbooks, written by experts. TutorEval helps measure real-life usability of LMs as scientific assistants, and it is the first benchmark combining long contexts, free-form generation, and multi-disciplinary scientific knowledge. Moreover, we show that fine-tuning base models with existing dialogue datasets leads to poor performance on TutorEval. Therefore, we create TutorChat, a dataset of 80,000 long synthetic dialogues about textbooks. We use TutorChat to fine-tune Llemma models with 7B and 34B parameters. These LM tutors specialized in math have a 32K-token context window, and they excel at TutorEval while performing strongly on GSM8K and MATH. Our datasets build on open-source materials, and we release our models, data, and evaluations publicly.'}",https://openreview.net{'value': '/pdf/21a2889654fe629571a9cdb02343900124196c1e.pdf'},{'abstract_filter': 'Synthetic'},ICML.cc,2024,Conference
https://openreview.net/forum?id=VuoB86HiCL,{'value': 'Automating the Selection of Proxy Variables of Unmeasured Confounders'},Feng Xie; Zhengming Chen; Shanshan Luo; Wang Miao; Ruichu Cai; Zhi Geng,~Feng_Xie1; ~Zhengming_Chen2; ~Shanshan_Luo2; ~Wang_Miao1; ~Ruichu_Cai1; ~Zhi_Geng1,,"{'value': 'Recently, interest has grown in the use of proxy variables of unobserved confounding for inferring the causal effect in the presence of unmeasured confounders from observational data. One difficulty inhibiting the practical use is finding valid proxy variables of unobserved confounding to a target causal effect of interest. These proxy variables are typically justified by background knowledge. In this paper, we investigate the estimation of causal effects among multiple treatments and a single outcome, all of which are affected by unmeasured confounders, within a linear causal model, without prior knowledge of the validity of proxy variables. To be more specific, we first extend the existing proxy variable estimator, originally addressing a single unmeasured confounder, to accommodate scenarios where multiple unmeasured confounders exist between the treatments and the outcome. Subsequently, we present two different sets of precise identifiability conditions for selecting valid proxy variables of unmeasured confounders, based on the second-order statistics and higher-order statistics of the data, respectively. Moreover, we propose two data-driven methods for the selection of proxy variables and for the unbiased estimation of causal effects. Theoretical analysis demonstrates the correctness of our proposed algorithms. Experimental results on both synthetic and real-world data show the effectiveness of the proposed approach.'}",https://openreview.net{'value': '/pdf/51aad5f1f0c80e82b56c379701e7ff85bd2b57ea.pdf'},{'abstract_filter': 'Synthetic'},ICML.cc,2024,Conference
https://openreview.net/forum?id=VsvfSMI5bs,{'value': 'BAGEL: Bootstrapping Agents by Guiding Exploration with Language'},Shikhar Murty; Christopher D Manning; Peter Shaw; Mandar Joshi; Kenton Lee,~Shikhar_Murty1; ~Christopher_D_Manning1; ~Peter_Shaw1; ~Mandar_Joshi1; ~Kenton_Lee1,,"{'value': 'Following natural language instructions by executing actions in digital environments (e.g. web-browsers and REST APIs) is a challenging task for language model (LM) agents. Unfortunately, LM agents often fail to generalize to new environments without human demonstrations. This work presents BAGEL, a method for bootstrapping LM agents without human supervision. BAGEL converts a seed set of randomly explored trajectories to synthetic demonstrations via round-trips between two noisy LM components: an LM labeler which converts a trajectory into a synthetic instruction, and a zero-shot LM agent which maps the synthetic instruction into a refined trajectory. By performing these round-trips iteratively, BAGEL quickly converts the initial distribution of trajectories towards those that are well-described by natural language. We adapt the base LM agent at test time with in-context learning by retrieving relevant BAGEL demonstrations based on the instruction, and find improvements of over 2-13% absolute on ToolQA and MiniWob++, with up to 13x reduction in execution failures.'}",https://openreview.net{'value': '/pdf/2783f896dc4c688f8410e6cdbe577dc298d5ffbd.pdf'},{'title_filter': 'Agent'},ICML.cc,2024,Conference
https://openreview.net/forum?id=ViZcgDQjyG,{'value': 'Position: Will we run out of data? Limits of LLM scaling based on human-generated data'},Pablo Villalobos; Anson Ho; Jaime Sevilla; Tamay Besiroglu; Lennart Heim; Marius Hobbhahn,~Pablo_Villalobos1; ~Anson_Ho1; jaime@epochai.org; tamay@epochai.org; ~Lennart_Heim1; ~Marius_Hobbhahn1,,"{'value': 'We investigate the potential constraints on LLM scaling posed by the availability of public human-generated text data. We forecast the growing demand for training data based on current trends and estimate the total stock of public human text data. Our findings indicate that if current LLM development trends continue, models will be trained on datasets roughly equal in size to the available stock of public human text data between 2026 and 2032, or slightly earlier if models are overtrained. We explore how progress in language modeling can continue when human-generated text datasets cannot be scaled any further. We argue that synthetic data generation, transfer learning from data-rich domains, and data efficiency improvements might support further progress.'}",https://openreview.net{'value': '/pdf/bfb3ffa8e9cee8f96d1ad2600d8617a958730bdb.pdf'},{'abstract_filter': 'Synthetic'},ICML.cc,2024,Conference
https://openreview.net/forum?id=VW7Jk8KhNC,{'value': 'Non-parametric Online Change Point Detection on Riemannian Manifolds'},Xiuheng Wang; Ricardo Augusto Borsoi; Cédric Richard,~Xiuheng_Wang1; ~Ricardo_Augusto_Borsoi1; ~Cédric_Richard1,,"{'value': 'Non-parametric detection of change points in streaming time series data that belong to Euclidean spaces has been extensively studied in the literature. Nevertheless, when the data belongs to a Riemannian manifold, existing approaches are no longer applicable as they fail to account for the structure and geometry of the manifold. In this paper, we introduce a non-parametric algorithm for online change point detection in manifold-valued data streams. This algorithm monitors the generalized Karcher mean of the data, computed using stochastic Riemannian optimization. We provide theoretical bounds on the detection and false alarm rate performances of the algorithm, using a new result on the non-asymptotic convergence of the stochastic Riemannian gradient descent. We apply our algorithm to two different Riemannian manifolds. Experimental results with both synthetic and real data illustrate the performance of the proposed method.'}",https://openreview.net{'value': '/pdf/f1060360d55a339d7729c38d361ade302c865b60.pdf'},{'abstract_filter': 'Synthetic'},ICML.cc,2024,Conference
https://openreview.net/forum?id=V4qV08Vk6S,{'value': 'An Embodied Generalist Agent in 3D World'},Jiangyong Huang; Silong Yong; Xiaojian Ma; Xiongkun Linghu; Puhao Li; Yan Wang; Qing Li; Song-Chun Zhu; Baoxiong Jia; Siyuan Huang,~Jiangyong_Huang1; ~Silong_Yong1; ~Xiaojian_Ma1; ~Xiongkun_Linghu1; ~Puhao_Li1; ~Yan_Wang24; ~Qing_Li1; ~Song-Chun_Zhu1; ~Baoxiong_Jia1; ~Siyuan_Huang2,,"{'value': ""Leveraging massive knowledge from large language models (LLMs), recent machine learning models show notable successes in general-purpose task solving in diverse domains such as computer vision and robotics. However, several significant challenges remain: (i) most of these models rely on 2D images yet exhibit a limited capacity for 3D input; (ii) these models rarely explore the tasks inherently defined in 3D world, e.g., 3D grounding, embodied reasoning and acting. We argue these limitations significantly hinder current models from performing real-world tasks and approaching general intelligence. To this end, we introduce LEO, an embodied multi-modal generalist agent that excels in perceiving, grounding, reasoning, planning, and acting in the 3D world. LEO is trained with a unified task interface, model architecture, and objective in two stages: (i) 3D vision-language (VL) alignment and (ii) 3D vision-language-action (VLA) instruction tuning. We collect large-scale datasets comprising diverse object-level and scene-level tasks, which require considerable understanding of and interaction with the 3D world. Moreover, we meticulously design an LLM-assisted pipeline to produce high-quality 3D VL data. Through extensive experiments, we demonstrate LEO's remarkable proficiency across a wide spectrum of tasks, including 3D captioning, question answering, embodied reasoning, navigation and manipulation. Our ablative studies and scaling analyses further provide valuable insights for developing future embodied generalist agents. Code and data are available on [project page](https://embodied-generalist.github.io/).""}",https://openreview.net{'value': '/pdf/c05b9e4c5fdd24c009b6825f60b1eb29633750b1.pdf'},{'title_filter': 'Agent'},ICML.cc,2024,Conference
https://openreview.net/forum?id=V3OpGwo68Z,{'value': 'Adapt and Diffuse: Sample-adaptive Reconstruction via Latent Diffusion Models'},Zalan Fabian; Berk Tinaz; Mahdi Soltanolkotabi,~Zalan_Fabian1; ~Berk_Tinaz1; ~Mahdi_Soltanolkotabi1,,"{'value': 'Inverse problems arise in a multitude of applications, where the goal is to recover a clean signal from noisy and possibly (non)linear observations. The difficulty of a reconstruction problem depends on multiple factors, such as the ground truth signal structure, the severity of the degradation and the complex interactions between the above. This results in natural sample-by-sample variation in the difficulty of a reconstruction problem. Our key observation is that most existing inverse problem solvers lack the ability to adapt their compute power to the difficulty of the reconstruction task, resulting in subpar performance and wasteful resource allocation. We propose a novel method, *severity encoding*, to estimate the degradation severity of corrupted signals in the latent space of an autoencoder. We show that the estimated severity has strong correlation with the true corruption level and can provide useful hints on the difficulty of reconstruction problems on a sample-by-sample basis. Furthermore, we propose a reconstruction method based on latent diffusion models that leverages the predicted degradation severities to fine-tune the reverse diffusion sampling trajectory and thus achieve sample-adaptive inference times. Our framework, Flash-Diffusion, acts as a wrapper that can be combined with any latent diffusion-based baseline solver, imbuing it with sample-adaptivity and acceleration. We perform experiments on both linear and nonlinear inverse problems and demonstrate that our technique greatly improves the performance of the baseline solver and achieves up to $10\\times$ acceleration in mean sampling speed.'}",https://openreview.net{'value': '/pdf/c0010f659cac8e5485a5020c696bf0520bbb0ead.pdf'},{'abstract_filter': 'Trajectory'},ICML.cc,2024,Conference
https://openreview.net/forum?id=UdXDUDxq11,{'value': 'Zero-Sum Positional Differential Games as a Framework for Robust Reinforcement Learning: Deep Q-Learning Approach'},Anton Plaksin; Vitaly Kalev,~Anton_Plaksin1; ~Vitaly_Kalev1,,"{'value': ""Robust Reinforcement Learning (RRL) is a promising Reinforcement Learning (RL) paradigm aimed at training robust to uncertainty or disturbances models, making them more efficient for real-world applications. Following this paradigm, uncertainty or disturbances are interpreted as actions of a second adversarial agent, and thus, the problem is reduced to seeking the agents' policies robust to any opponent's actions. This paper is the first to propose considering the RRL problems within the positional differential game theory, which helps us to obtain theoretically justified intuition to develop a centralized Q-learning approach. Namely, we prove that under Isaacs's condition (sufficiently general for real-world dynamical systems), the same Q-function can be utilized as an approximate solution of both minimax and maximin Bellman equations. Based on these results, we present the Isaacs Deep Q-Network algorithms and demonstrate their superiority compared to other baseline RRL and Multi-Agent RL algorithms in various environments.""}",https://openreview.net{'value': '/pdf/0ef899174d6f71f0272d31cba9ef4a9de1c6624d.pdf'},{'abstract_filter': 'Agent'},ICML.cc,2024,Conference
https://openreview.net/forum?id=TfWKkSAziC,{'value': 'LPGD: A General Framework for Backpropagation through Embedded Optimization Layers'},Anselm Paulus; Georg Martius; Vít Musil,~Anselm_Paulus1; ~Georg_Martius1; ~Vít_Musil1,,"{'value': 'Embedding parameterized optimization problems as layers into machine learning architectures serves as a powerful inductive bias. Training such architectures with stochastic gradient descent requires care, as degenerate derivatives of the embedded optimization problem often render the gradients uninformative. We propose Lagrangian Proximal Gradient Descent (LPGD), a flexible framework for training architectures with embedded optimization layers that seamlessly integrates into automatic differentiation libraries. LPGD efficiently computes meaningful replacements of the degenerate optimization layer derivatives by re-running the forward solver oracle on a perturbed input. LPGD captures various previously proposed methods as special cases, while fostering deep links to traditional optimization methods. We theoretically analyze our method and demonstrate on historical and synthetic data that LPGD converges faster than gradient descent even in a differentiable setup.'}",https://openreview.net{'value': '/pdf/f9e3c8fd04f6e05c559a85b2eb573cdac18fd70f.pdf'},{'abstract_filter': 'Synthetic'},ICML.cc,2024,Conference
https://openreview.net/forum?id=TejqrQBvll,"{'value': 'Generalization Bounds for Causal Regression: Insights, Guarantees and Sensitivity Analysis'}",Daniel Csillag; Claudio Jose Struchiner; Guilherme Tegoni Goedert,~Daniel_Csillag1; ~Claudio_Jose_Struchiner1; ~Guilherme_Tegoni_Goedert1,,"{'value': 'Many algorithms have been recently proposed for causal machine learning. Yet, there is little to no theory on their quality, especially considering finite samples. In this work, we propose a theory based on generalization bounds that provides such guarantees. By introducing a novel change-of-measure inequality, we are able to tightly bound the model loss in terms of the deviation of the treatment propensities over the population, which we show can be empirically limited. Our theory is fully rigorous and holds even in the face of hidden confounding and violations of positivity. We demonstrate our bounds on semi-synthetic and real data, showcasing their remarkable tightness and practical utility.'}",https://openreview.net{'value': '/pdf/a4b44f1642f23224e648561d90128eaa765a51a8.pdf'},{'abstract_filter': 'Synthetic'},ICML.cc,2024,Conference
https://openreview.net/forum?id=TTZXl9WYFF,{'value': 'Multi-Agent Reinforcement Learning with Hierarchical Coordination for Emergency Responder Stationing'},Amutheezan Sivagnanam; Ava Pettet; Hunter Lee; Ayan Mukhopadhyay; Abhishek Dubey; Aron Laszka,~Amutheezan_Sivagnanam1; ~Ava_Pettet1; ~Hunter_Lee1; ~Ayan_Mukhopadhyay1; ~Abhishek_Dubey1; ~Aron_Laszka1,,"{'value': 'An emergency responder management (ERM) system dispatches responders, such as ambulances, when it receives requests for medical aid. ERM systems can also proactively reposition responders between predesignated waiting locations to cover any gaps that arise due to the prior dispatch of responders or significant changes in the distribution of anticipated requests. Optimal repositioning is computationally challenging due to the exponential number of ways to allocate responders between locations and the uncertainty in future requests. The state-of-the-art approach in proactive repositioning is a hierarchical approach based on spatial decomposition and online Monte Carlo tree search, which may require minutes of computation for each decision in a domain where seconds can save lives. We address the issue of long decision times by introducing a novel reinforcement learning (RL) approach, based on the same hierarchical decomposition, but replacing online search with learning. To address the computational challenges posed by large, variable-dimensional, and discrete state and action spaces, we propose: (1) actor-critic based agents that incorporate transformers to handle variable-dimensional states and actions, (2) projections to fixed-dimensional observations to handle complex states, and (3) combinatorial techniques to map continuous actions to discrete allocations. We evaluate our approach using real-world data from two U.S. cities, Nashville, TN and Seattle, WA. Our experiments show that compared to the state of the art, our approach reduces computation time per decision by three orders of magnitude, while also slightly reducing average ambulance response time by 5 seconds.'}",https://openreview.net{'value': '/pdf/20b523099603aaa5ed4fea07c3edbbf36e727d08.pdf'},{'title_filter': 'Agent'},ICML.cc,2024,Conference
https://openreview.net/forum?id=TTYVG17wfc,{'value': 'OSN: Infinite Representations of Dynamic 3D Scenes from Monocular Videos'},Ziyang Song; Jinxi Li; Bo Yang,~Ziyang_Song1; ~Jinxi_Li2; ~Bo_Yang7,,"{'value': 'It has long been challenging to recover the underlying dynamic 3D scene representations from a monocular RGB video. Existing works formulate this problem into finding a single most plausible solution by adding various constraints such as depth priors and strong geometry constraints, ignoring the fact that there could be infinitely many 3D scene representations corresponding to a single dynamic video. In this paper, we aim to learn all plausible 3D scene configurations that match the input video, instead of just inferring a specific one. To achieve this ambitious goal, we introduce a new framework, called OSN. The key to our approach is a simple yet innovative object scale network together with a joint optimization module to learn an accurate scale range for every dynamic 3D object. This allows us to sample as many faithful 3D scene configurations as possible. Extensive experiments show that our method surpasses all baselines and achieves superior accuracy in dynamic novel view synthesis on multiple synthetic and real-world datasets. Most notably, our method demonstrates a clear advantage in learning fine-grained 3D scene geometry.'}",https://openreview.net{'value': '/pdf/60688ce9ab1a3878dfdaa0805fb6534cd31fcf5d.pdf'},{'abstract_filter': 'Synthetic'},ICML.cc,2024,Conference
https://openreview.net/forum?id=TJCUrzhbiH,{'value': 'diff History for Neural Language Agents'},Ulyana Piterbarg; Lerrel Pinto; Rob Fergus,~Ulyana_Piterbarg1; ~Lerrel_Pinto1; ~Rob_Fergus1,,"{'value': 'Neural Language Models (LMs) offer an exciting solution for general-purpose embodied control. However, a key technical issue arises when using an LM-based controller: environment observations must be converted to text, which coupled with history, results in long and verbose textual prompts. As a result, prior work in LM agents is limited to restricted domains with small observation size as well as minimal needs for interaction history or instruction finetuning. In this paper, we introduce diff history, a simple and highly effective solution to these issues. By applying the Unix diff command on consecutive text observations in the interaction histories used to prompt LM policies, we can both abstract away redundant information and focus the content of textual inputs on the salient changes in the environment. On NetHack, an unsolved video game that requires long-horizon reasoning for decision-making, LMs tuned with diff history match state-of-the-art performance for neural agents while needing 1800X fewer training examples compared to prior work. Even on the simpler BabyAI-Text environment with concise text observations, we find that although diff history increases the length of prompts, the representation it provides offers a 25% improvement in the efficiency of low-sample instruction finetuning. Further, we show that diff history scales favorably across different finetuning dataset sizes. We open-source our code and data to https://diffhistory.github.io.'}",https://openreview.net{'value': '/pdf/3272d736eb88d087a8817bf1d85827ec5b8b78af.pdf'},{'title_filter': 'Agent'},ICML.cc,2024,Conference
https://openreview.net/forum?id=Sz9mAYuqlE,{'value': 'Optimally Improving Cooperative Learning in a Social Setting'},Shahrzad Haddadan; Cheng Xin; Jie Gao,~Shahrzad_Haddadan1; ~Cheng_Xin2; ~Jie_Gao6,,"{'value': 'We consider a cooperative learning scenario where a collection of networked agents with individually owned classifiers dynamically update their predictions, for the same classification task, through communication or observations of each other’s predictions. Clearly if highly influential vertices use erroneous classifiers, there will be a negative effect on the accuracy of all the agents in the network. We ask the following question: how can we optimally fix the prediction of a few classifiers so as maximize the overall accuracy in the entire network. To this end we consider an aggregate and an egalitarian objective function. We show a polynomial time algorithm for optimizing the aggregate objective function, and show that optimizing the egalitarian objective function is NP-hard. Furthermore, we develop approximation algorithms for the egalitarian improvement. The performance of all of our algorithms are guaranteed by mathematical analysis and backed by experiments on synthetic and real data.'}",https://openreview.net{'value': '/pdf/8de2e5e7219a47e92934c5d310e4d0d5f6233dc9.pdf'},{'abstract_filter': 'Synthetic'},ICML.cc,2024,Conference
