forum,title,authors,authorids,keywords,abstract,pdf,match,venue,year,type
https://openreview.net/forum?id=HssOwuZiaB,{'value': 'Eureka-Moments in Transformers: Multi-Step Tasks Reveal Softmax Induced Optimization Problems'},David T Hoffmann; Simon Schrodi; Jelena Bratulić; Nadine Behrmann; Volker Fischer; Thomas Brox,~David_T_Hoffmann1; ~Simon_Schrodi1; ~Jelena_Bratulić1; ~Nadine_Behrmann1; ~Volker_Fischer1; ~Thomas_Brox1,,"{'value': 'In this work, we study rapid improvements of the training loss in transformers when being confronted with multi-step decision tasks. We found that transformers struggle to learn the intermediate task and both training and validation loss saturate for hundreds of epochs. When transformers finally learn the intermediate task, they do this rapidly and unexpectedly. We call these abrupt improvements Eureka-moments, since the transformer appears to suddenly learn a previously incomprehensible concept. We designed synthetic tasks to study the problem in detail, but the leaps in performance can be observed also for language modeling and in-context learning (ICL). We suspect that these abrupt transitions are caused by the multi-step nature of these tasks. Indeed, we find connections and show that ways to improve on the synthetic multi-step tasks can be used to improve the training of language modeling and ICL. Using the synthetic data we trace the problem back to the Softmax function in the self-attention block of transformers and show ways to alleviate the problem. These fixes reduce the required number of training steps, lead to higher likelihood to learn the intermediate task, to higher final accuracy and training becomes more robust to hyper-parameters.'}",https://openreview.net{'value': '/pdf/255af945027cc215c984fd05a24a0a620451528b.pdf'},{'abstract_filter': 'Synthetic'},ICML.cc,2024,Conference
https://openreview.net/forum?id=HrzQZXzrN2,{'value': 'Predictive Performance Comparison of Decision Policies Under Confounding'},Luke Guerdan; Amanda Lee Coston; Ken Holstein; Steven Wu,~Luke_Guerdan1; ~Amanda_Lee_Coston1; ~Ken_Holstein1; ~Steven_Wu1,,"{'value': 'Predictive models are often introduced to decision-making tasks under the rationale that they improve performance over an existing decision-making policy. However, it is challenging to compare predictive performance against an existing decision-making policy that is generally under-specified and dependent on unobservable factors. These sources of uncertainty are often addressed in practice by making strong assumptions about the data-generating mechanism. In this work, we propose a method to compare the predictive performance of decision policies under a variety of modern identification approaches from the causal inference and off-policy evaluation literatures (e.g., instrumental variable, marginal sensitivity model, proximal variable). Key to our method is the insight that there are regions of uncertainty that we can safely ignore in the policy comparison. We develop a practical approach for finite-sample estimation of regret intervals under no assumptions on the parametric form of the status quo policy. We verify our framework theoretically and via synthetic data experiments. We conclude with a real-world application using our framework to support a pre-deployment evaluation of a proposed modification to a healthcare enrollment policy.'}",https://openreview.net{'value': '/pdf/8600a2e5e665779b5b43982873cd7c9f2488afbe.pdf'},{'abstract_filter': 'Synthetic'},ICML.cc,2024,Conference
https://openreview.net/forum?id=HbdeEGVfEN,{'value': 'Deep Regression Representation Learning with Topology'},Shihao Zhang; Kenji Kawaguchi; Angela Yao,~Shihao_Zhang1; ~Kenji_Kawaguchi1; ~Angela_Yao1,,"{'value': 'Most works studying representation learning focus only on classification and neglect regression. Yet, the learning objectives and, therefore, the representation topologies of the two tasks are fundamentally different: classification targets class separation, leading to disconnected representations, whereas regression requires ordinality with respect to the target, leading to continuous representations. We thus wonder how the effectiveness of a regression representation is influenced by its topology, with evaluation based on the Information Bottleneck (IB) principle. The IB principle is an important framework that provides principles for learning effective representations. We establish two connections between it and the topology of regression representations. The first connection reveals that a lower intrinsic dimension of the feature space implies a reduced complexity of the representation $Z$. This complexity can be quantified as the conditional entropy of $Z$ on the target $Y$, and serves as an upper bound on the generalization error. The second connection suggests a feature space that is topologically similar to the target space will better align with the IB principle. Based on these two connections, we introduce PH-Reg, a regularizer specific to regression that matches the intrinsic dimension and topology of the feature space with the target space. Experiments on synthetic and real-world regression tasks demonstrate the benefits of PH-Reg. Code: https://github.com/needylove/PH-Reg.'}",https://openreview.net{'value': '/pdf/e834b0f5c058898fc3f36fa67af7bc43bec6cf65.pdf'},{'abstract_filter': 'Synthetic'},ICML.cc,2024,Conference
https://openreview.net/forum?id=HTMFUKAm8B,{'value': 'A Field Guide for Pacing Budget and ROS Constraints'},Santiago R. Balseiro; Kshipra Bhawalkar; Zhe Feng; Haihao Lu; Vahab Mirrokni; Balasubramanian Sivan; Di Wang,~Santiago_R._Balseiro1; ~Kshipra_Bhawalkar1; ~Zhe_Feng3; ~Haihao_Lu2; ~Vahab_Mirrokni2; ~Balasubramanian_Sivan1; ~Di_Wang4,,"{'value': ""Budget pacing is a popular service that has been offered by major internet advertising platforms since their inception. In the past few years, autobidding products that provide real-time bidding as a service to advertisers have seen a prominent rise in adoption. A popular autobidding stategy is value maximization subject to return-on-spend (ROS) constraints. For historical or business reasons, the systems that govern these two services, namely budget pacing and ROS pacing, are not necessarily always a single unified and coordinated entity that optimizes a global objective subject to both constraints. The purpose of this work is to theoretically and empirically compare algorithms with different degrees of coordination between these two pacing systems. In particular, we compare (a) a fully-decoupled sequential algorithm; (b) a minimally-coupled min-pacing algorithm; (c) a fully-coupled dual-based algorithm. Our main contribution is to theoretically analyze the min-pacing algorithm and show that it attains similar guarantees to the fully-coupled canonical dual-based algorithm. On the other hand, we show that the sequential algorithm, even though appealing by virtue of being fully decoupled, could badly violate the constraints. We validate our theoretical findings empirically by showing that the min-pacing algorithm performs almost as well as the canonical dual-based algorithm on a semi-synthetic dataset that was generated from a large online advertising platform's auction data.""}",https://openreview.net{'value': '/pdf/f6a633d69edbe4728c85f6462e86ce0585220f77.pdf'},{'abstract_filter': 'Synthetic'},ICML.cc,2024,Conference
https://openreview.net/forum?id=HQtTg1try7,{'value': 'Adversarial Robustness Limits via Scaling-Law and Human-Alignment Studies'},Brian R. Bartoldson; James Diffenderfer; Konstantinos Parasyris; Bhavya Kailkhura,~Brian_R._Bartoldson1; ~James_Diffenderfer1; ~Konstantinos_Parasyris2; ~Bhavya_Kailkhura1,,"{'value': ""This paper revisits the simple, long-studied, yet still unsolved problem of making image classifiers robust to imperceptible perturbations. Taking CIFAR10 as an example, SOTA clean accuracy is about $100$%, but SOTA robustness to $\\ell_{\\infty}$-norm bounded perturbations barely exceeds $70$%. To understand this gap, we analyze how model size, dataset size, and synthetic data quality affect robustness by developing the first scaling laws for adversarial training. Our scaling laws reveal inefficiencies in prior art and provide actionable feedback to advance the field. For instance, we discovered that SOTA methods diverge notably from compute-optimal setups, using excess compute for their level of robustness. Leveraging a compute-efficient setup, we surpass the prior SOTA with $20$% ($70$%) fewer training (inference) FLOPs. We trained various compute-efficient models, with our best achieving $74$% AutoAttack accuracy ($+3$% gain). However, our scaling laws also predict robustness slowly grows then plateaus at $90$%: dwarfing our new SOTA by scaling is impractical, and perfect robustness is impossible. To better understand this predicted limit, we carry out a small-scale human evaluation on the AutoAttack data that fools our top-performing model. Concerningly, we estimate that human performance also plateaus near $90$%, which we show to be attributable to $\\ell_{\\infty}$-constrained attacks' generation of invalid images not consistent with their original labels. Having characterized limiting roadblocks, we outline promising paths for future research.""}",https://openreview.net{'value': '/pdf/2bb15515c17df8cd8b771bbb3167aa1737d2c34f.pdf'},{'abstract_filter': 'Synthetic'},ICML.cc,2024,Conference
https://openreview.net/forum?id=HDrXBr26UI,{'value': 'Neuro-Symbolic Temporal Point Processes'},Yang Yang; Chao Yang; Boyang Li; Yinghao Fu; Shuang Li,~Yang_Yang56; ~Chao_Yang9; ~Boyang_Li4; ~Yinghao_Fu1; ~Shuang_Li3,,"{'value': 'Our goal is to $\\textit{efficiently}$ discover a compact set of temporal logic rules to explain irregular events of interest. We introduce a neural-symbolic rule induction framework within the temporal point process model. The negative log-likelihood is the loss that guides the learning, where the explanatory logic rules and their weights are learned end-to-end in a $\\textit{differentiable}$ way. Specifically, predicates and logic rules are represented as $\\textit{vector embeddings}$, where the predicate embeddings are fixed and the rule embeddings are trained via gradient descent to obtain the most appropriate compositional representations of the predicate embeddings. To make the rule learning process more efficient and flexible, we adopt a $\\textit{sequential covering algorithm}$, which progressively adds rules to the model and removes the event sequences that have been explained until all event sequences have been covered. All the found rules will be fed back to the models for a final rule embedding and weight refinement. Our approach showcases notable efficiency and accuracy across synthetic and real datasets, surpassing state-of-the-art baselines by a wide margin in terms of efficiency.'}",https://openreview.net{'value': '/pdf/a034d801cc76f664bc002bee239c5f56ef7a89d8.pdf'},{'abstract_filter': 'Synthetic'},ICML.cc,2024,Conference
https://openreview.net/forum?id=H86WzfH5N1,{'value': 'On the Trajectory Regularity of ODE-based Diffusion Sampling'},Defang Chen; Zhenyu Zhou; Can Wang; Chunhua Shen; Siwei Lyu,~Defang_Chen1; ~Zhenyu_Zhou6; ~Can_Wang5; ~Chunhua_Shen2; ~Siwei_Lyu1,,"{'value': 'Diffusion-based generative models use stochastic differential equations (SDEs) and their equivalent ordinary differential equations (ODEs) to establish a smooth connection between a complex data distribution and a tractable prior distribution. In this paper, we identify several intriguing trajectory properties in the ODE-based sampling process of diffusion models. We characterize an implicit denoising trajectory and discuss its vital role in forming the coupled sampling trajectory with a strong shape regularity, regardless of the generated content. We also describe a dynamic programming-based scheme to make the time schedule in sampling better fit the underlying trajectory structure. This simple strategy requires minimal modification to any given ODE-based numerical solvers and incurs negligible computational cost, while delivering superior performance in image generation, especially in $5\\sim 10$ function evaluations.'}",https://openreview.net{'value': '/pdf/f4de47001284bc7d0394f73e965f7e7a8666d6cb.pdf'},{'title_filter': 'Trajectory'},ICML.cc,2024,Conference
https://openreview.net/forum?id=H3bATm4mKn,{'value': 'Out of the Ordinary: Spectrally Adapting Regression for Covariate Shift'},Benjamin Eyre; Elliot Creager; David Madras; Vardan Papyan; Richard Zemel,~Benjamin_Eyre1; ~Elliot_Creager1; ~David_Madras1; ~Vardan_Papyan1; ~Richard_Zemel1,,"{'value': 'Designing deep neural network classifiers that perform robustly on distributions differing from the available training data is an active area of machine learning research. However, out-of-distribution generalization for regression---the analogous problem for modeling continuous targets---remains relatively unexplored. To tackle this problem, we return to first principles and analyze how the closed-form solution for Ordinary Least Squares (OLS) regression is sensitive to covariate shift. We characterize the out-of-distribution risk of the OLS model in terms of the eigenspectrum decomposition of the source and target data. We then use this insight to propose a method called Spectral Adapted Regressor (SpAR) for adapting the weights of the last layer of a pre-trained neural regression model to perform better on input data originating from a different distribution. We demonstrate how this lightweight spectral adaptation procedure can improve out-of-distribution performance for synthetic and real-world datasets.'}",https://openreview.net{'value': '/pdf/4a05637872a7560d88ea1d256be6499140eea24f.pdf'},{'abstract_filter': 'Synthetic'},ICML.cc,2024,Conference
https://openreview.net/forum?id=GktjBAGgo4,{'value': 'Reducing Balancing Error for Causal Inference via Optimal Transport'},Yuguang Yan; Hao Zhou; Zeqin Yang; Weilin Chen; Ruichu Cai; Zhifeng Hao,~Yuguang_Yan1; ~Hao_Zhou23; ~Zeqin_Yang1; ~Weilin_Chen1; ~Ruichu_Cai1; ~Zhifeng_Hao5,,"{'value': 'Most studies on causal inference tackle the issue of confounding bias by reducing the distribution shift between the control and treated groups. However, it remains an open question to adopt an appropriate metric for distribution shift in practice. In this paper, we define a generic balancing error on reweighted samples to characterize the confounding bias, and study the connection between the balancing error and the Wasserstein discrepancy derived from the theory of optimal transport. We not only regard the Wasserstein discrepancy as the metric of distribution shift, but also explore the association between the balancing error and the underlying cost function involved in the Wasserstein discrepancy. Motivated by this, we propose to reduce the balancing error under the framework of optimal transport with learnable marginal distributions and the cost function, which is implemented by jointly learning weights and representations associated with factual outcomes. The experiments on both synthetic and real-world datasets demonstrate the effectiveness of our proposed method.'}",https://openreview.net{'value': '/pdf/4f6962d6d84dd5545b20293abffedb22e2312010.pdf'},{'abstract_filter': 'Synthetic'},ICML.cc,2024,Conference
https://openreview.net/forum?id=GJzqRKOdRi,{'value': 'From Inverse Optimization to Feasibility to ERM'},Saurabh kumar Mishra; Anant Raj; Sharan Vaswani,~Saurabh_kumar_Mishra1; ~Anant_Raj2; ~Sharan_Vaswani1,,"{'value': 'Inverse optimization involves inferring unknown parameters of an optimization problem from known solutions and is widely used in fields such as transportation, power systems, and healthcare. We study the *contextual inverse optimization setting* that utilizes additional contextual information to better predict the unknown problem parameters. We focus on contextual inverse linear programming (CILP) addressing the challenges posed by the non-differentiable nature of LPs. For a linear prediction model, we reduce CILP to a convex feasibility problem allowing the use of standard algorithms such as alternating projections. The resulting algorithm for CILP is equipped with theoretical convergence guarantees without additional assumptions such as degeneracy or interpolation. Next, we reduce CILP to empirical risk minimization (ERM) on a smooth, convex loss that satisfies the Polyak-Lojasiewicz condition. This reduction enables the use of scalable first-order optimization methods to solve large non-convex problems while maintaining theoretical guarantees in the convex setting. Subsequently, we use the reduction to ERM to quantify the generalization performance of the proposed algorithm on previously unseen instances. Finally, we experimentally validate our approach on synthetic and real-world problems and demonstrate improved performance compared to existing methods.'}",https://openreview.net{'value': '/pdf/30a4041178df6c926142f31c99bc843ece238c47.pdf'},{'abstract_filter': 'Synthetic'},ICML.cc,2024,Conference
https://openreview.net/forum?id=GDp7Gyd9nf,{'value': 'Mechanistic Design and Scaling of Hybrid Architectures'},Michael Poli; Armin W Thomas; Eric Nguyen; Pragaash Ponnusamy; Björn Deiseroth; Kristian Kersting; Taiji Suzuki; Brian Hie; Stefano Ermon; Christopher Re; Ce Zhang; Stefano Massaroli,~Michael_Poli1; ~Armin_W_Thomas1; ~Eric_Nguyen1; ~Pragaash_Ponnusamy1; ~Björn_Deiseroth1; ~Kristian_Kersting1; ~Taiji_Suzuki1; brianhie@stanford.edu; ~Stefano_Ermon1; ~Christopher_Re1; ~Ce_Zhang1; ~Stefano_Massaroli1,,"{'value': 'The development of deep learning architectures is a resource-demanding process, due to a vast design space, long prototyping times, and high compute costs associated with at-scale model training and evaluation. We set out to simplify this process by grounding it in an end-to-end mechanistic architecture design (MAD) pipeline, encompassing small-scale capability unit tests predictive of scaling laws. Through a suite of synthetic token manipulation tasks such as compression and recall, designed to probe capabilities, we identify and test new hybrid architectures constructed from a variety of computational primitives. We experimentally validate the resulting architectures via an extensive compute-optimal and a new state-optimal scaling law analysis, training over 500 language models between 70M to 7B parameters. Surprisingly, we find MAD synthetics to correlate with compute-optimal perplexity, enabling accurate evaluation of new architectures via isolated proxy tasks. The new architectures found via MAD, based on simple ideas such as hybridization and sparsity, outperform state-of-the-art Transformer, convolutional, and recurrent architectures (Transformer++, Hyena, Mamba) in scaling, both at compute-optimal budgets and in overtrained regimes. Overall, these results provide evidence that performance on curated synthetic tasks can be predictive of scaling laws, and that an optimal architecture should leverage specialized layers via a hybrid topology.'}",https://openreview.net{'value': '/pdf/1f23a20e6e98232c95c75607749544c9df15185c.pdf'},{'abstract_filter': 'Synthetic'},ICML.cc,2024,Conference
https://openreview.net/forum?id=G0z4bCNmkG,{'value': 'ByMI: Byzantine Machine Identification with False Discovery Rate Control'},Chengde Qian; Mengyuan Wang; Haojie Ren; Changliang Zou,~Chengde_Qian1; ~Mengyuan_Wang2; ~Haojie_Ren1; ~Changliang_Zou2,,"{'value': 'Various robust estimation methods or algorithms have been proposed to hedge against Byzantine failures in distributed learning. However, there is a lack of systematic approaches to provide theoretical guarantees of significance in detecting those Byzantine machines. In this paper, we develop a general detection procedure, ByMI, via error rate control to address this issue, which is applicable to many robust learning problems. The key idea is to apply the sample-splitting strategy on each worker machine to construct a score statistic integrated with a general robust estimation and then to utilize the symmetry property of those scores to derive a data-driven threshold. The proposed method is dimension insensitive and p-value free with the help of the symmetry property and can achieve false discovery rate control under mild conditions. Numerical experiments on both synthetic and real data validate the theoretical results and demonstrate the effectiveness of our proposed method on Byzantine machine identification.'}",https://openreview.net{'value': '/pdf/d8122c8888faadab02d07a0060f14c09fd9ab98c.pdf'},{'abstract_filter': 'Synthetic'},ICML.cc,2024,Conference
https://openreview.net/forum?id=Fzp1DRzCIN,{'value': 'Implicit meta-learning may lead language models to trust more reliable sources'},Dmitrii Krasheninnikov; Egor Krasheninnikov; Bruno Kacper Mlodozeniec; Tegan Maharaj; David Krueger,~Dmitrii_Krasheninnikov1; ~Egor_Krasheninnikov1; ~Bruno_Kacper_Mlodozeniec2; ~Tegan_Maharaj1; ~David_Krueger1,,"{'value': 'We demonstrate that large language models (LLMs) may learn indicators of document usefulness and modulate their updates accordingly. We introduce random strings (""tags"") as indicators of usefulness in a synthetic fine-tuning dataset. Fine-tuning on this dataset leads to **implicit meta-learning (IML)**: in further fine-tuning, the model updates to make more use of text that is tagged as useful. We perform a thorough empirical investigation of this phenomenon, finding (among other things) that (i) it occurs in both pretrained LLMs and those trained from scratch, as well as on a vision task, and (ii) larger models and smaller batch sizes tend to give more IML. We also use probing to examine how IML changes the way models store knowledge in their parameters. Finally, we reflect on what our results might imply about the capabilities, risks, and controllability of future AI systems.'}",https://openreview.net{'value': '/pdf/f9ff7df1c721b133862e6327f51393e368a6dd80.pdf'},{'abstract_filter': 'Synthetic'},ICML.cc,2024,Conference
https://openreview.net/forum?id=FQQ4476dT2,{'value': 'FightLadder: A Benchmark for Competitive Multi-Agent Reinforcement Learning'},Wenzhe Li; Zihan Ding; Seth Karten; Chi Jin,~Wenzhe_Li2; ~Zihan_Ding1; ~Seth_Karten1; ~Chi_Jin1,,"{'value': 'Recent advances in reinforcement learning (RL) heavily rely on a variety of well-designed benchmarks, which provide environmental platforms and consistent criteria to evaluate existing and novel algorithms. Specifically, in multi-agent RL (MARL), a plethora of benchmarks based on cooperative games have spurred the development of algorithms that improve the scalability of cooperative multi-agent systems. However, for the competitive setting, a lightweight and open-sourced benchmark with challenging gaming dynamics and visual inputs has not yet been established. In this work, we present FightLadder, a real-time fighting game platform, to empower competitive MARL research. Along with the platform, we provide implementations of state-of-the-art MARL algorithms for competitive games, as well as a set of evaluation metrics to characterize the performance and exploitability of agents. We demonstrate the feasibility of this platform by training a general agent that consistently defeats 12 built-in characters in single-player mode, and expose the difficulty of training a non-exploitable agent without human knowledge and demonstrations in two-player mode. FightLadder provides meticulously designed environments to address critical challenges in competitive MARL research, aiming to catalyze a new era of discovery and advancement in the field. Videos and code at https://sites.google.com/view/fightladder/home.'}",https://openreview.net{'value': '/pdf/108e490ca041bf79b4022833a8e3a87f90615bf2.pdf'},{'title_filter': 'Agent'},ICML.cc,2024,Conference
https://openreview.net/forum?id=FCmWhJQ14I,{'value': 'Evaluation of Trajectory Distribution Predictions with Energy Score'},Novin Shahroudi; Mihkel Lepson; Meelis Kull,~Novin_Shahroudi1; ~Mihkel_Lepson1; ~Meelis_Kull1,,"{'value': 'Predicting the future trajectory of surrounding objects is inherently uncertain and vital in the safe and reliable planning of autonomous systems such as in self-driving cars. Although trajectory prediction models have become increasingly sophisticated in dealing with the complexities of spatiotemporal data, the evaluation methods used to assess these models have not kept pace. ""Minimum of N"" is a common family of metrics used to assess the rich outputs of such models. We critically examine the Minimum of N within the proper scoring rules framework to show that it is not strictly proper and demonstrate how that could lead to a misleading assessment of multimodal trajectory predictions. As an alternative, we propose using Energy Score-based evaluation measures, leveraging their proven propriety for a more reliable evaluation of trajectory distribution predictions.'}",https://openreview.net{'value': '/pdf/ebcc0b1955e28327a9562073b6524f7ea3ad163b.pdf'},{'title_filter': 'Trajectory'},ICML.cc,2024,Conference
