forum,title,keywords,abstract,pdf,match,venue,year,type
https://openreview.net/forum?id=M6XWoEdmwf,{'value': 'AMAGO: Scalable In-Context Reinforcement Learning for Adaptive Agents'},Jake Grigsby; Linxi Fan; Yuke Zhu,~Jake_Grigsby1; ~Linxi_Fan2; ~Yuke_Zhu1,"{'value': ['Meta-RL', 'Generalization', 'Long-Term Memory', 'Transformers']}","{'value': ""We introduce AMAGO, an in-context Reinforcement Learning (RL) agent that uses sequence models to tackle the challenges of generalization, long-term memory, and meta-learning. Recent works have shown that off-policy learning can make in-context RL with recurrent policies viable. Nonetheless, these approaches require extensive tuning and limit scalability by creating key bottlenecks in agents' memory capacity, planning horizon, and model size. AMAGO revisits and redesigns the off-policy in-context approach to successfully train long-sequence Transformers over entire rollouts in parallel with end-to-end RL. Our agent is scalable and applicable to a wide range of problems, and we demonstrate its strong performance empirically in meta-RL and long-term memory domains. AMAGO's focus on sparse rewards and off-policy data also allows in-context learning to extend to goal-conditioned problems with challenging exploration. When combined with a multi-goal hindsight relabeling scheme, AMAGO can solve a previously difficult category of open-world domains, where agents complete many possible instructions in procedurally generated environments.""}",https://openreview.net{'value': '/pdf/6ffd1eb5dc0bd2b144d5d0309763b3ed5e114e8b.pdf'},{'title_filter': 'Agent'},ICLR.cc,2024,Conference
https://openreview.net/forum?id=LjivA1SLZ6,{'value': 'Efficient Episodic Memory Utilization of Cooperative Multi-Agent Reinforcement Learning'},Hyungho Na; Yunkyeong Seo; Il-chul Moon,~Hyungho_Na1; ~Yunkyeong_Seo1; ~Il-chul_Moon1,"{'value': ['Multi-agent reinforcement learning', 'episodic control', 'episodic incentive', 'state embedding']}","{'value': 'In cooperative multi-agent reinforcement learning (MARL), agents aim to achieve a common goal, such as defeating enemies or scoring a goal. Existing MARL algorithms are effective but still require significant learning time and often get trapped in local optima by complex tasks, subsequently failing to discover a goal-reaching policy. To address this, we introduce Efficient episodic Memory Utilization (EMU) for MARL, with two primary objectives: (a) accelerating reinforcement learning by leveraging semantically coherent memory from an episodic buffer and (b) selectively promoting desirable transitions to prevent local convergence. To achieve (a), EMU incorporates a trainable encoder/decoder structure alongside MARL, creating coherent memory embeddings that facilitate exploratory memory recall. To achieve (b), EMU introduces a novel reward structure called episodic incentive based on the desirability of states. This reward improves the TD target in Q-learning and acts as an additional incentive for desirable transitions. We provide theoretical support for the proposed incentive and demonstrate the effectiveness of EMU compared to conventional episodic control. The proposed method is evaluated in StarCraft II and Google Research Football, and empirical results indicate further performance improvement over state-of-the-art methods.'}",https://openreview.net{'value': '/pdf/8b2d5ac5539754d00bf99458a60c63157c74fbdb.pdf'},{'title_filter': 'Agent'},ICLR.cc,2024,Conference
https://openreview.net/forum?id=LemSSn8htt,{'value': 'Delta-AI: Local objectives for amortized inference in sparse graphical models'},Jean-Pierre René Falet; Hae Beom Lee; Nikolay Malkin; Chen Sun; Dragos Secrieru; Dinghuai Zhang; Guillaume Lajoie; Yoshua Bengio,~Jean-Pierre_René_Falet1; ~Hae_Beom_Lee1; ~Nikolay_Malkin1; ~Chen_Sun7; ~Dragos_Secrieru1; ~Dinghuai_Zhang1; ~Guillaume_Lajoie1; ~Yoshua_Bengio1,"{'value': ['amortized inference', 'variational inference', 'graphical models', 'Markov random fields', 'generative flow networks', 'GFlowNets']}","{'value': ""We present a new algorithm for amortized inference in sparse probabilistic graphical models (PGMs), which we call $\\Delta$-amortized inference ($\\Delta$-AI). Our approach is based on the observation that when the sampling of variables in a PGM is seen as a sequence of actions taken by an agent, sparsity of the PGM enables local credit assignment in the agent's policy learning objective. This yields a local constraint that can be turned into a local loss in the style of generative flow networks (GFlowNets) that enables off-policy training but avoids the need to instantiate all the random variables for each parameter update, thus speeding up training considerably. The $\\Delta$-AI objective matches the conditional distribution of a variable given its Markov blanket in a tractable learned sampler, which has the structure of a Bayesian network, with the same conditional distribution under the target PGM. As such, the trained sampler recovers marginals and conditional distributions of interest and enables inference of partial subsets of variables. We illustrate $\\Delta$-AI's effectiveness for sampling from synthetic PGMs and training latent variable models with sparse factor structure. Code: https://github.com/GFNOrg/Delta-AI.""}",https://openreview.net{'value': '/pdf/05a032243d28184a3102f9fc03c775e53cc11f84.pdf'},{'abstract_filter': 'Synthetic'},ICLR.cc,2024,Conference
https://openreview.net/forum?id=LYG6tBlEX0,{'value': 'H-GAP: Humanoid Control with a Generalist Planner'},zhengyao jiang; Yingchen Xu; Nolan Wagener; Yicheng Luo; Michael Janner; Edward Grefenstette; Tim Rocktäschel; Yuandong Tian,~zhengyao_jiang2; ~Yingchen_Xu2; ~Nolan_Wagener1; ~Yicheng_Luo1; ~Michael_Janner1; ~Edward_Grefenstette1; ~Tim_Rocktäschel1; ~Yuandong_Tian1,"{'value': ['Generative Modelling', 'Humanoid Control', 'Model Predictive Control', 'Model-based Reinforcement Learning', 'Offline Reinforcement Learning']}","{'value': 'Humanoid control is an important research challenge offering avenues for integration into human-centric infrastructures and enabling physics-driven humanoid animations.\nThe daunting challenges in this field stem from the difficulty of optimizing in high-dimensional action spaces and the instability introduced by the bipedal morphology of humanoids. \nHowever, the extensive collection of human motion-captured data and the derived datasets of humanoid trajectories, such as MoCapAct, paves the way to tackle these challenges. In this context, we present Humanoid Generalist Autoencoding Planner (H-GAP), a state-action trajectory generative model trained on humanoid trajectories derived from human motion-captured data, capable of adeptly handling downstream control tasks with Model Predictive Control (MPC).\nFor 56 degrees of freedom humanoid, we empirically demonstrate that H-GAP learns to represent and generate a wide range of motor behaviors. Further, without any learning from online interactions, it can also flexibly transfer these behaviours to solve novel downstream control tasks via planning. Notably, H-GAP excels established MPC baselines with access to the ground truth model, and is superior or comparable to offline RL methods trained for individual tasks.\nFinally, we do a series of empirical studies on the scaling properties of H-GAP, showing the potential for performance gains via additional data but not computing.'}",https://openreview.net{'value': '/pdf/5572333360c59f829af61902b8f2157f4a2e4109.pdf'},{'abstract_filter': 'Trajectory'},ICLR.cc,2024,Conference
https://openreview.net/forum?id=LY3ukUANko,{'value': 'Zoology: Measuring and Improving  Recall in Efficient Language Models'},Simran Arora; Sabri Eyuboglu; Aman Timalsina; Isys Johnson; Michael Poli; James Zou; Atri Rudra; Christopher Re,~Simran_Arora1; ~Sabri_Eyuboglu1; ~Aman_Timalsina1; ~Isys_Johnson1; ~Michael_Poli1; ~James_Zou1; ~Atri_Rudra1; ~Christopher_Re1,"{'value': ['nlp', 'language models', 'representation learning', 'in-context learning']}","{'value': 'Attention-free language models that combine gating and convolutions are growing in popularity due to their efficiency and increasingly competitive performance. To better understand these architectures, we pretrain a suite of 17 attention and gated-convolution language models, finding that SoTA gated-convolution architectures still underperform attention by up to 2.1 perplexity points on the Pile. In fine-grained analysis, we find 82% of the gap is explained by each model\'s ability to recall information that is previously mentioned in-context, e.g. ""Hakuna Matata means no worries Hakuna Matata it means no"" -> ??. On this task, termed ""associative recall"", we find that attention outperforms gated-convolutions by a large margin: a 70M parameter attention model outperforms a 1.4 billion parameter gated-convolution model on associative recall. This is surprising because prior work shows gated convolutions can perfectly solve synthetic tests for AR capability.  To close the gap between synthetics and real language, we develop a new formalization of the task called multi-query associative recall (MQAR) that better reflects actual language. We perform an empirical and theoretical study of MQAR that elucidates differences in the parameter-efficiency of attention and gated-convolution recall. Informed by our analysis, we evaluate simple convolution-attention hybrids and show that hybrids with input-dependent sparse attention patterns can close 97.4% of the gap to attention, while maintaining sub-quadratic scaling. Code is at: https://github.com/HazyResearch/zoology.'}",https://openreview.net{'value': '/pdf/80fadc4fc3c3c1a12600b7f7e0e3d13e04ac334b.pdf'},{'abstract_filter': 'Synthetic'},ICLR.cc,2024,Conference
https://openreview.net/forum?id=KsUh8MMFKQ,{'value': 'Thin-Shell Object Manipulations With Differentiable Physics Simulations'},Yian Wang; Juntian Zheng; Zhehuan Chen; Zhou Xian; Gu Zhang; Chao Liu; Chuang Gan,~Yian_Wang1; ~Juntian_Zheng1; ~Zhehuan_Chen1; ~Zhou_Xian1; ~Gu_Zhang1; ~Chao_Liu9; ~Chuang_Gan1,"{'value': ['differentiable physics simulation', 'thin-shell object manipulation']}","{'value': ""In this work, we aim to teach robots to manipulate various thin-shell materials. \nPrior works studying thin-shell object manipulation mostly rely on heuristic policies or learn policies from real-world video demonstrations, and only focus on limited material types and tasks (e.g., cloth unfolding). However, these approaches face significant challenges when extended to a wider variety of thin-shell materials and a diverse range of tasks.\nOn the other hand, while virtual simulations are shown to be effective in diverse robot skill learning and evaluation, prior thin-shell simulation environments only support a subset of thin-shell materials, which also limits their supported range of tasks. \nTo fill in this gap, we introduce ThinShellLab - a fully differentiable simulation platform tailored for robotic interactions with diverse thin-shell materials possessing varying material properties, enabling flexible thin-shell manipulation skill learning and evaluation. Building on top of our developed simulation engine, we design a diverse set of manipulation tasks centered around different thin-shell objects. Our experiments suggest that manipulating thin-shell objects presents several unique challenges: 1) thin-shell manipulation relies heavily on frictional forces due to the objects' co-dimensional nature, 2) the materials being manipulated are highly sensitive to minimal variations in interaction actions, and 3) the constant and frequent alteration in contact pairs makes trajectory optimization methods susceptible to local optima, and neither standard reinforcement learning algorithms nor trajectory optimization methods (either gradient-based or gradient-free) are able to solve the tasks alone. To overcome these challenges, we present an optimization scheme that couples sampling-based trajectory optimization and gradient-based optimization, boosting both learning efficiency and converged performance across various proposed tasks. In addition, the differentiable nature of our platform facilitates a smooth sim-to-real transition. By tuning simulation parameters with a minimal set of real-world data, we demonstrate successful deployment of the learned skills to real-robot settings.  ThinShellLab will be publicly available. Video demonstration and more information can be found on the project website https://vis-www.cs.umass.edu/ThinShellLab/.""}",https://openreview.net{'value': '/pdf/edbd3be2c1ca4369cdf41d2d892af284a0c21cc3.pdf'},{'abstract_filter': 'Trajectory'},ICLR.cc,2024,Conference
https://openreview.net/forum?id=KpoQSgxbKH,{'value': 'Generative Pre-training for Speech with Flow Matching'},Alexander H. Liu; Matthew Le; Apoorv Vyas; Bowen Shi; Andros Tjandra; Wei-Ning Hsu,~Alexander_H._Liu1; ~Matthew_Le2; ~Apoorv_Vyas1; ~Bowen_Shi1; ~Andros_Tjandra1; ~Wei-Ning_Hsu2,"{'value': ['speech pre-training', 'speech generation', 'generative pre-training', 'flow matching']}","{'value': 'Generative models have gained more and more attention in recent years for their remarkable success in tasks that required estimating and sampling data distribution to generate high-fidelity synthetic data. In speech, text-to-speech synthesis and neural vocoder are good examples where generative models have shined. While generative models have been applied to different applications in speech, there exists no general-purpose generative model that models speech directly. In this work, we take a step toward this direction by showing a single pre-trained generative model can be adapted to different downstream tasks with strong performance. Specifically, we pre-trained a generative model, named SpeechFlow, on 60k hours of untranscribed speech with Flow Matching and masked conditions. Experiment results show the pre-trained generative model can be fine-tuned with task-specific data to match or surpass existing expert models on speech enhancement, separation, and synthesis. Our work suggested a foundational model for generation tasks in speech can be built with generative pre-training.'}",https://openreview.net{'value': '/pdf/965802a3d520fc25d1998740667c0a9b3f841a8f.pdf'},{'abstract_filter': 'Synthetic'},ICLR.cc,2024,Conference
https://openreview.net/forum?id=KdVvOA00Or,{'value': 'ReTaSA: A Nonparametric Functional Estimation Approach for Addressing Continuous Target Shift'},Hwanwoo Kim; Xin Zhang; Jiwei Zhao; Qinglong Tian,~Hwanwoo_Kim1; ~Xin_Zhang16; ~Jiwei_Zhao1; ~Qinglong_Tian1,"{'value': ['label shift', 'target shift', 'distributional shift', 'domain adaptation', 'transfer learning', 'importance weight']}","{'value': 'The presence of distribution shifts poses a significant challenge for deploying modern machine learning models in real-world applications. This work focuses on the target shift problem in a regression setting  (Zhang et al., 2013; Nguyen et al., 2016). More specifically, the target variable $y$ (also known as the response variable), which is continuous, has different marginal distributions in the training source and testing domain, while the conditional distribution of features $\\boldsymbol{x}$ given $y$ remains the same. While most literature focuses on classification tasks with finite target space, the regression problem has an *infinite dimensional* target space, which makes many of the existing methods inapplicable. In this work, we show that the continuous target shift problem can be addressed by estimating the importance weight function from an ill-posed integral equation. We propose a nonparametric regularized approach named *ReTaSA* to solve the ill-posed integral equation and provide theoretical justification for the estimated importance weight function. The effectiveness of the proposed method has been demonstrated with extensive numerical studies on synthetic and real-world datasets.'}",https://openreview.net{'value': '/pdf/d1da110b25cfb405463528a072d97b9b1bf77c6c.pdf'},{'abstract_filter': 'Synthetic'},ICLR.cc,2024,Conference
https://openreview.net/forum?id=KY8ZNcljVU,{'value': 'NetInfoF Framework: Measuring and Exploiting Network Usable Information'},Meng-Chieh Lee; Haiyang Yu; Jian Zhang; Vassilis N. Ioannidis; Xiang song; Soji Adeshina; Da Zheng; Christos Faloutsos,~Meng-Chieh_Lee1; ~Haiyang_Yu6; ~Jian_Zhang32; ~Vassilis_N._Ioannidis1; ~Xiang_song1; ~Soji_Adeshina1; ~Da_Zheng1; ~Christos_Faloutsos1,"{'value': ['Graph Neural Networks', 'Information Theory', 'Heterophily Graphs']}","{'value': 'Given a node-attributed graph, and a graph task (link prediction or node classification), can we tell if a graph neural network (GNN) will perform well? More specifically, do the graph structure and the node features carry enough usable information for the task? Our goals are\n(1) to develop a fast tool to measure how much information is in the graph structure and in the node features, and\n(2) to exploit the information to solve the task, if there is enough.\nWe propose NetInfoF, a framework including NetInfoF_Probe and NetInfoF_Act, for the measurement and the exploitation of network usable information (NUI), respectively. Given a graph data, NetInfoF_Probe measures NUI without any model training, and NetInfoF_Act solves link prediction and node classification, while two modules share the same backbone.\nIn summary, NetInfoF has following notable advantages:\n(a) General, handling both link prediction and node classification;\n(b) Principled, with theoretical guarantee and closed-form solution;\n(c) Effective, thanks to the proposed adjustment to node similarity;\n(d) Scalable, scaling linearly with the input size.\nIn our carefully designed synthetic datasets, NetInfoF correctly identifies the ground truth of NUI and is the only method being robust to all graph scenarios. Applied on real-world datasets, NetInfoF wins in 11 out of 12 times on link prediction compared to general GNN baselines.'}",https://openreview.net{'value': '/pdf/472fc3640b561e46ab9bb9189f262b42f5ef4114.pdf'},{'abstract_filter': 'Synthetic'},ICLR.cc,2024,Conference
https://openreview.net/forum?id=KOZu91CzbK,{'value': 'Retroformer: Retrospective Large Language Agents with Policy Gradient Optimization'},Weiran Yao; Shelby Heinecke; Juan Carlos Niebles; Zhiwei Liu; Yihao Feng; Le Xue; Rithesh R N; Zeyuan Chen; Jianguo Zhang; Devansh Arpit; Ran Xu; Phil L Mui; Huan Wang; Caiming Xiong; Silvio Savarese,~Weiran_Yao1; ~Shelby_Heinecke1; ~Juan_Carlos_Niebles1; ~Zhiwei_Liu3; ~Yihao_Feng1; ~Le_Xue1; ~Rithesh_R_N1; ~Zeyuan_Chen1; ~Jianguo_Zhang3; ~Devansh_Arpit2; ~Ran_Xu1; ~Phil_L_Mui1; ~Huan_Wang1; ~Caiming_Xiong1; ~Silvio_Savarese1,"{'value': ['Language Agent', 'AI Agent', 'Reinforcement Learning']}","{'value': 'Recent months have seen the emergence of a powerful new trend in which large language models (LLMs) are augmented to become autonomous language agents capable of performing objective oriented multi-step tasks on their own, rather than merely responding to queries from human users. Most existing language agents, however, are not optimized using environment-specific rewards. Although some agents enable iterative refinement through verbal feedback, they do not reason and plan in ways that are compatible with gradient-based learning from rewards. This paper introduces a principled framework for reinforcing large language agents by learning a retrospective model, which automatically tunes the language agent prompts from environment feedback through policy gradient. Specifically, our proposed agent architecture learns from rewards across multiple environments and tasks, for fine-tuning a pre-trained language model which refines the language agent prompt by summarizing the root cause of prior failed attempts and proposing action plans. Experimental results on various tasks demonstrate that the language agents improve over time and that our approach considerably outperforms baselines that do not properly leverage gradients from the environment.'}",https://openreview.net{'value': '/pdf/d02f39256b41ec50ca8cd3a5b136065bc7a4caae.pdf'},{'title_filter': 'Agent'},ICLR.cc,2024,Conference
https://openreview.net/forum?id=JORAfH2xFd,{'value': 'On the Stability of Iterative Retraining of Generative Models on their own Data'},Quentin Bertrand; Joey Bose; Alexandre Duplessis; Marco Jiralerspong; Gauthier Gidel,~Quentin_Bertrand1; ~Joey_Bose1; ~Alexandre_Duplessis1; ~Marco_Jiralerspong1; ~Gauthier_Gidel1,"{'value': ['Generative Models', 'Iterative Training', 'Diffusion']}","{'value': ""Deep generative models have made tremendous progress in modeling complex data, often exhibiting generation quality that surpasses a typical human's ability to discern the authenticity of samples. Undeniably, a key driver of this success is enabled by the massive amounts of web-scale data consumed by these models. Due to these models' striking performance and ease of availability, the web will inevitably be increasingly populated with synthetic content. Such a fact directly implies that future iterations of generative models will be trained on both clean and artificially generated data from past models. In this paper, we develop a framework to rigorously study the impact of training generative models on mixed datasets---from classical training on real data to self-consuming generative models trained on purely synthetic data. We first prove the stability of iterative training under the condition that the initial generative models approximate the data distribution well enough and the proportion of clean training data (w.r.t. synthetic data) is large enough. We empirically validate our theory on both synthetic and natural images by iteratively training normalizing flows and state-of-the-art diffusion models on CIFAR10 and FFHQ.""}",https://openreview.net{'value': '/pdf/119c01132e3767a01a8777074185c4c7f8fb3824.pdf'},{'abstract_filter': 'Synthetic'},ICLR.cc,2024,Conference
https://openreview.net/forum?id=IoKRezZMxF,{'value': 'Consistent Video-to-Video Transfer Using Synthetic Dataset'},Jiaxin Cheng; Tianjun Xiao; Tong He,~Jiaxin_Cheng1; ~Tianjun_Xiao1; ~Tong_He5,"{'value': ['Computer Vision', 'Video Editing', 'Diffusion Model']}","{'value': ""We introduce a novel and efficient approach for text-based video-to-video editing that eliminates the need for resource-intensive per-video-per-model finetuning. At the core of our approach is a synthetic paired video dataset tailored for video-to-video transfer tasks. Inspired by Instruct Pix2Pix's image transfer via editing instruction, we adapt this paradigm to the video domain. Extending the Prompt-to-Prompt to videos, we efficiently generate paired samples, each with an input video and its edited counterpart. Alongside this, we introduce the Long Video Sampling Correction during sampling, ensuring consistent long videos across batches. Our method surpasses current methods like Tune-A-Video, heralding substantial progress in text-based video-to-video editing and suggesting exciting avenues for further exploration and deployment.""}",https://openreview.net{'value': '/pdf/e91267e5675cf150b685ada8cd0303644c45a25f.pdf'},{'title_filter': 'Synthetic'},ICLR.cc,2024,Conference
https://openreview.net/forum?id=I2mIxuXA72,{'value': 'Understanding Domain Generalization: A Noise Robustness Perspective'},Rui Qiao; Bryan Kian Hsiang Low,~Rui_Qiao3; ~Bryan_Kian_Hsiang_Low1,"{'value': ['out-of-distribution generalization', 'distribution shifts', 'spurious correlation', 'noise robustness']}","{'value': 'Despite the rapid development of machine learning algorithms for domain generalization (DG), there is no clear empirical evidence that the existing DG algorithms outperform the classic empirical risk minimization (ERM) across standard benchmarks. To better understand this phenomenon, we investigate whether there are benefits of DG algorithms over ERM through the lens of label noise.\nSpecifically, our finite-sample analysis reveals that label noise exacerbates the effect of spurious correlations for ERM, undermining generalization. \nConversely, we illustrate that DG algorithms exhibit implicit label-noise robustness during finite-sample training even when spurious correlation is present.\nSuch desirable property helps mitigate spurious correlations and improve generalization in synthetic experiments. \nHowever, additional comprehensive experiments on real-world benchmark datasets indicate that label-noise robustness does not necessarily translate to better performance compared to ERM. \nWe conjecture that the failure mode of ERM arising from spurious correlations may be less pronounced in practice. Our code is available at https://github.com/qiaoruiyt/NoiseRobustDG'}",https://openreview.net{'value': '/pdf/a53902576d4d742fd5f4175a0e1c0ee4657327ad.pdf'},{'abstract_filter': 'Synthetic'},ICLR.cc,2024,Conference
