forum,title,keywords,abstract,pdf,match,venue,year,type
https://openreview.net/forum?id=zAdUB0aCTQ,{'value': 'AgentBench: Evaluating LLMs as Agents'},"{'value': ['Large language models', 'Autonomous agents', 'Reasoning', 'Evaluation', 'Benchmark']}","{'value': ""The potential of Large Language Model (LLM) as agents has been widely acknowledged recently.\nThus, there is an urgent need to quantitatively evaluate LLMs as agents on challenging tasks in interactive environments.\nWe present AgentBench, a multi-dimensional benchmark that consists of 8 distinct environments to assess LLM-as-Agent's reasoning and decision-making abilities.\nOur extensive test over 29 API-based and open-sourced (OSS) LLMs shows that, while top commercial LLMs present a strong ability of acting as agents in complex environments, there is a significant disparity in performance between them and many OSS competitors that are no larger than 70B.\nWe identify the typical reasons of failures in environments and LLMs, showing that poor long-term reasoning, decision-making, and instruction following abilities are the main obstacles for developing usable LLM agents.\nImproving instruction following and training on high quality multi-round alignment data could improve agent performance.\nAnd different from existing assumptions, training on code present ambivalent impacts on different agent tasks.\nDatasets, environments, and an integrated evaluation package for AgentBench are released at https://github.com/THUDM/AgentBench.""}",https://openreview.net{'value': '/pdf/6eee0bd1fd98c135372baedb2a5644233a013bb2.pdf'},{'title_filter': 'Agent'},ICLR.cc,2024,Conference
https://openreview.net/forum?id=z6KS9D1dxt,{'value': 'Byzantine Robust Cooperative Multi-Agent Reinforcement Learning as a Bayesian Game'},"{'value': ['Multi-agent reinforcement learning', 'Robustness', 'Game Theory', 'Adversarial Attack']}","{'value': 'In this study, we explore the robustness of cooperative multi-agent reinforcement learning (c-MARL) against Byzantine failures, where any agent can enact arbitrary, worst-case actions due to malfunction or adversarial attack. To address the uncertainty that any agent can be adversarial, we propose a Bayesian Adversarial Robust Dec-POMDP (BARDec-POMDP) framework, which views Byzantine adversaries as nature-dictated types, represented by a separate transition. This allows agents to learn policies grounded on their posterior beliefs about the type of other agents, fostering collaboration with identified allies and minimizing vulnerability to adversarial manipulation. We define the optimal solution to the BARDec-POMDP as an ex interim robust Markov perfect Bayesian equilibrium, which we proof to exist and the corresponding policy weakly dominates previous approaches as time goes to infinity. To realize this equilibrium, we put forward a two-timescale actor-critic algorithm with almost sure convergence under specific conditions. Experiments on matrix game, Level-based Foraging and StarCraft II indicate that, our method successfully acquires intricate micromanagement skills and adaptively aligns with allies under worst-case perturbations, showing resilience against non-oblivious adversaries, random allies, observation-based attacks, and transfer-based attacks.'}",https://openreview.net{'value': '/pdf/ae82041a50b5244c3cc55d71579b529584e36982.pdf'},{'title_filter': 'Agent'},ICLR.cc,2024,Conference
https://openreview.net/forum?id=yoVq2BGQdP,{'value': 'Achieving Fairness in Multi-Agent MDP Using Reinforcement Learning'},"{'value': ['Fairness', 'Multi-Agent Reinforcement Learning', 'Markov Decision Process']}","{'value': ""Fairness plays a crucial role in various multi-agent systems (e.g., communication networks, financial markets, etc.). Many multi-agent dynamical interactions can be cast as Markov Decision Processes (MDPs). While existing research has focused on studying fairness in known environments, the exploration of fairness in such systems for unknown environments remains open. In this paper, we propose a  Reinforcement Learning (RL) approach to achieve fairness in multi-agent finite-horizon episodic MDPs. Instead of maximizing the sum of individual agents' value functions, we introduce a fairness function that ensures equitable rewards across agents. Since the classical Bellman's equation does not hold when the sum of individual value functions is not maximized, we cannot use traditional approaches. Instead, in order to explore, we maintain a confidence bound of the unknown environment and then propose an online convex optimization based approach to obtain a policy constrained to this confidence region. We show that such an approach achieves sub-linear regret in terms of the number of episodes. Additionally, we provide a probably approximately correct (PAC) guarantee based on the obtained regret bound. We also propose an offline RL algorithm and bound the optimality gap with respect to the optimal fair solution. To mitigate computational complexity, we introduce a policy-gradient type method for the fair objective. Simulation experiments also demonstrate the efficacy of our approach.""}",https://openreview.net{'value': '/pdf/832d7ea57a154b15de9382f6f8db49dad34bc05e.pdf'},{'title_filter': 'Agent'},ICLR.cc,2024,Conference
https://openreview.net/forum?id=wFWuX1Fhtj,{'value': 'On the Hardness of Constrained Cooperative Multi-Agent Reinforcement Learning'},"{'value': ['Multi-Agent Reinforcement Learning', 'Constrained reinforcement learning', 'Primal-Dual', 'Duality gap', 'Primal algorithm']}","{'value': 'Constrained cooperative multi-agent reinforcement learning (MARL) is an emerging learning framework that has been widely applied to manage multi-agent systems, and many primal-dual type algorithms have been developed for it. However, the convergence of primal-dual algorithms crucially relies on strong duality -- a condition that has not been formally proved in constrained cooperative MARL. In this work, we prove that strong duality fails to hold in constrained cooperative MARL, by revealing a nonconvex quadratic type constraint on the occupation measure induced by the product policy. Consequently, our reanalysis of the primal-dual algorithm shows that its convergence rate is hindered by the nonzero duality gap. Then, we propose a decentralized primal approach for constrained cooperative MARL to avoid the duality gap, and our analysis shows that its convergence is hindered by another gap induced by the advantage functions. Moreover, we compare these two types of algorithms via concrete examples, and show that neither of them always outperforms the other one. Our study reveals that constrained cooperative MARL is generally a challenging and highly nonconvex problem, and its fundamental structure is very different from that of single-agent constrained RL.'}",https://openreview.net{'value': '/pdf/fbb1a9eec51b42b14f0f37676f9db8b154cbc9d2.pdf'},{'title_filter': 'Agent'},ICLR.cc,2024,Conference
https://openreview.net/forum?id=vZZ4hhniJU,{'value': 'Learning Multi-Agent Communication with Contrastive Learning'},"{'value': ['Multi-Agent Reinforcement Learning', 'Emergent Communication', 'Contrastive Learning']}","{'value': 'Communication is a powerful tool for coordination in multi-agent RL. But inducing an effective, common language is a difficult challenge, particularly in the decentralized setting. In this work, we introduce an alternative perspective where communicative messages sent between agents are considered as different incomplete views of the environment state. By examining the relationship between messages sent and received, we propose to learn to communicate using contrastive learning to maximize the mutual information between messages of a given trajectory. In communication-essential environments, our method outperforms previous work in both performance and learning speed. Using qualitative metrics and representation probing, we show that our method induces more symmetric communication and captures global state information from the environment. Overall, we show the power of contrastive learning and the importance of leveraging messages as encodings for effective communication.'}",https://openreview.net{'value': '/pdf/2c9dcdc69b3da56a7ebdec7279ee8bc8087b5c39.pdf'},{'title_filter': 'Agent'},ICLR.cc,2024,Conference
https://openreview.net/forum?id=tmqOhBC4a5,{'value': 'Maximum Entropy Heterogeneous-Agent Reinforcement Learning'},"{'value': ['cooperative multi-agent reinforcement learning', 'heterogeneous-agent soft actor-critic', 'maximum entropy heterogeneous-agent mirror learning']}","{'value': '*Multi-agent reinforcement learning* (MARL) has been shown effective for cooperative games in recent years. However, existing state-of-the-art methods face challenges related to sample complexity, training instability, and the risk of converging to a suboptimal Nash Equilibrium. In this paper, we propose a unified framework for learning \\emph{stochastic} policies to resolve these issues. We embed cooperative MARL problems into probabilistic graphical models, from which we derive the maximum entropy (MaxEnt) objective for MARL. Based on the MaxEnt framework, we propose *Heterogeneous-Agent Soft Actor-Critic* (HASAC) algorithm. Theoretically, we prove the monotonic improvement and convergence to *quantal response equilibrium* (QRE) properties of HASAC. Furthermore, we generalize a unified template for MaxEnt algorithmic design named *Maximum Entropy Heterogeneous-Agent Mirror Learning* (MEHAML), which provides any induced method with the same guarantees as HASAC. We evaluate HASAC on six benchmarks: Bi-DexHands, Multi-Agent MuJoCo, StarCraft Multi-Agent Challenge, Google Research Football, Multi-Agent Particle Environment, and Light Aircraft Game. Results show that HASAC consistently outperforms strong baselines, exhibiting better sample efficiency, robustness, and sufficient exploration.'}",https://openreview.net{'value': '/pdf/82bacc9b0a9551bf4922e43270f4c315044f70af.pdf'},{'title_filter': 'Agent'},ICLR.cc,2024,Conference
https://openreview.net/forum?id=s9z0HzWJJp,{'value': 'SocioDojo: Building Lifelong Analytical Agents with Real-world Text and Time Series'},"{'value': ['Large Langauge Models', 'Agent', 'Prompt Tunning', 'Time series forcasting']}","{'value': 'We introduce SocioDojo, an open-ended lifelong learning environment for developing ready-to-deploy autonomous agents capable of performing human-like analysis and decision-making on societal topics such as economics, finance, politics, and culture. It consists of (1) information sources from news, social media, reports, etc., (2) a knowledge base built from books, journals, and encyclopedias, plus a toolbox of Internet and knowledge graph search interfaces, (3) 30K high-quality time series in finance, economy, society, and polls, which support a novel task called ""hyperportfolio"", that can reliably and scalably evaluate societal analysis and decision-making power of agents, inspired by portfolio optimization with time series as assets to ""invest"". We also propose a novel Analyst-Assistant-Actuator architecture for the hyperportfolio task, and a Hypothesis & Proof prompting for producing in-depth analyses on input news, articles, etc. to assist decision-making. We perform experiments and ablation studies to explore the factors that impact performance. The results show that our proposed method achieves improvements of 32.4% and 30.4% compared to the state-of-the-art method in the two experimental settings.'}",https://openreview.net{'value': '/pdf/473beb76f232cb31d5e4d7594a17375a1347cef9.pdf'},{'title_filter': 'Agent'},ICLR.cc,2024,Conference
https://openreview.net/forum?id=pAoqRlTBtY,{'value': 'Causal Modelling Agents: Causal Graph Discovery through Synergising Metadata- and Data-driven Reasoning'},"{'value': ['Causal Reasoning', 'Causal Discovery', 'Structural Causal Models', 'Large Language Models']}","{'value': ""Scientific discovery hinges on the effective integration of metadata, which refers to a set of 'cognitive' operations such as determining what information is relevant for inquiry, and data, which encompasses physical operations such as observation and experimentation. This paper introduces the Causal Modelling Agent (CMA), a novel framework that synergizes the metadata-based reasoning capabilities of Large Language Models (LLMs) with the data-driven modelling of Deep Structural Causal Models (DSCMs) for the task of causal discovery. We evaluate the CMA's performance on a number of benchmarks, as well as on the real-world task of modelling the clinical and radiological phenotype of Alzheimer's Disease (AD). Our experimental results indicate that the CMA can outperform previous data-driven or metadata-driven approaches to causal discovery. In our real-world application, we use the CMA to derive new insights into the causal relationships among biomarkers of AD.""}",https://openreview.net{'value': '/pdf/62fc3766e10c6f5fa2f2a9b44b46098519f89596.pdf'},{'title_filter': 'Agent'},ICLR.cc,2024,Conference
https://openreview.net/forum?id=oQKKlzxV1o,{'value': 'Online Information Acquisition: Hiring Multiple Agents'},"{'value': ['online learning', 'information acquisition', 'mechanism design']}","{'value': ""We investigate the mechanism design problem faced by a principal who hires \\emph{multiple} agents to gather and report costly information. Then, the principal exploits the  information to make an informed decision.  We model this problem as a game, where the principal announces a mechanism consisting in action recommendations and a payment function, a.k.a. scoring rule. Then, each agent chooses an effort level and receives partial information about an underlying state of nature based on the effort. Finally, the agents report the information (possibly non-truthfully), the principal takes a decision based on this information, and the agents are paid according to the scoring rule. While previous work focuses on single-agent problems, we consider multi-agents settings. This poses the challenge of coordinating the agents' efforts and aggregating correlated information. Indeed, we show that optimal mechanisms must correlate agents' efforts, which introduces externalities among the agents, and hence complex incentive compatibility constraints and equilibrium selection problems. First, we design a polynomial-time algorithm to find an optimal incentive compatible mechanism. Then, we study an online problem, where the principal repeatedly interacts with a group of unknown agents. We design a no-regret algorithm that provides $\\widetilde{\\mathcal{O}}(T^{2/3})$ regret with respect to an optimal mechanism, matching the state-of-the-art bound for single-agent settings.""}",https://openreview.net{'value': '/pdf/83fcb8ac23e715a1b18621cd00f0a8a7d023dc7a.pdf'},{'title_filter': 'Agent'},ICLR.cc,2024,Conference
https://openreview.net/forum?id=oKn9c6ytLx,{'value': 'WebArena: A Realistic Web Environment for Building Autonomous Agents'},{'value': ['language-guided agents; web automation; benchmark']},"{'value': 'With advances in generative AI, there is now potential for autonomous agents to manage daily tasks via natural language commands. However, current agents are primarily created and tested in simplified synthetic environments, leading to a disconnect with real-world scenarios. In this paper, we build an environment for language-guided agents that is highly realistic and reproducible. Specifically, we focus on agents that perform tasks on the web, and create an environment with fully functional websites from four common domains: e-commerce, social forum discussions, collaborative software development, and content management. Our environment is enriched with tools (e.g., a map) and external knowledge bases (e.g., user manuals) to encourage human-like task-solving. Building upon our environment, we release a set of benchmark tasks focusing on evaluating the functional correctness of task completions. The tasks in our benchmark are diverse, long-horizon, and designed to emulate tasks that humans routinely perform on the internet. We experiment with several baseline agents, integrating recent techniques such as reasoning before acting.  The results demonstrate that solving complex tasks is challenging: our best GPT-4-based agent only achieves an end-to-end task success rate of 14.41%, significantly lower than the human performance of 78.24%. These results highlight the need for further development of robust agents, that current state-of-the-art large language models are far from perfect performance in these real-life tasks, and that \\ours can be used to measure such progress.\\footnote{Code, data, environment reproduction instructions, video demonstrations are available in the supplementary.}'}",https://openreview.net{'value': '/pdf/384c500abb2b5adc4f3c40956a267477925c4b94.pdf'},{'title_filter': 'Agent'},ICLR.cc,2024,Conference
https://openreview.net/forum?id=o7qhUMylLU,{'value': 'Sample-Efficient Multi-Agent RL: An Optimization Perspective'},"{'value': ['multi-agent reinforcement learning', 'theory', 'general function approximation', 'general-sum Markov Games']}","{'value': 'We study multi-agent reinforcement learning (MARL) for the general-sum Markov Games (MGs) under general function approximation. \n    In order to find the minimum assumption for sample-efficient learning, we introduce a novel complexity measure called the Multi-Agent Decoupling Coefficient (MADC) for general-sum MGs. Using this measure, we propose the first unified algorithmic framework that ensures sample efficiency in learning Nash Equilibrium, Coarse Correlated Equilibrium, and Correlated Equilibrium for both model-based and model-free MARL problems with low MADC. We also show that our algorithm provides comparable sublinear regret to the existing works. Moreover, our algorithm combines an equilibrium-solving oracle with a single objective optimization subprocedure that solves for the regularized payoff of each deterministic joint policy, which avoids solving constrained optimization problems within data-dependent constraints (Jin et al. 2020; Wang et al. 2023) or executing sampling procedures with complex multi-objective optimization problems (Foster et al. 2023), thus being more amenable to empirical implementation.'}",https://openreview.net{'value': '/pdf/fe5b0154a5ddbf71df6a0cd9077a345a6fa6065c.pdf'},{'title_filter': 'Agent'},ICLR.cc,2024,Conference
https://openreview.net/forum?id=mM7VurbA4r,{'value': 'SOTOPIA: Interactive Evaluation for Social Intelligence in Language Agents'},"{'value': ['Social', 'Interaction', 'Agent', 'Social intelligence', 'Large Language Models', 'Evaluation', 'Theory of Mind']}","{'value': ""*Humans are social beings*; we pursue social goals in our daily interactions, which is a crucial aspect of social intelligence. Yet, AI systems' abilities in this realm remain elusive. We present SOTOPIA, an open-ended environment to simulate complex social interactions between artificial agents and evaluate their social intelligence. In our environment, agents role-play and *interact* under a wide variety of scenarios; they coordinate, collaborate, exchange, and compete with each other to achieve complex social goals. We simulate the role-play interaction between LLM-based agents and humans within this task space and evaluate their performance with a holistic evaluation framework called SOTOPIA-Eval. With SOTOPIA, we find significant differences between these models in terms of their social intelligence, and we identify a subset of SOTOPIA scenarios, SOTOPIA-hard, that is generally challenging for all models. We find that on this subset, GPT-4 achieves a significantly lower goal completion rate than humans and struggles to exhibit social commonsense reasoning and strategic communication skills. These findings demonstrate SOTOPIA's promise as a general platform for research on evaluating and improving social intelligence in artificial agents.""}",https://openreview.net{'value': '/pdf/6aece1f9088fc415196df5830f1ca62e6dbf37d3.pdf'},{'title_filter': 'Agent'},ICLR.cc,2024,Conference
https://openreview.net/forum?id=hNhwSmtXRh,{'value': 'Lemur: Harmonizing Natural Language and Code for Language Agents'},"{'value': ['large language model', 'agent', 'code generation', 'reasoning', 'decision making']}","{'value': 'We introduce Lemur and Lemur-Chat, openly accessible language models optimized\nfor both natural language and coding capabilities to serve as the backbone\nof versatile language agents. The evolution from language chat models to\nfunctional language agents demands that models not only master human interaction,\nreasoning, and planning but also ensure grounding in the relevant environments.\nThis calls for a harmonious blend of language and coding capabilities\nin the models. Lemur and Lemur-Chat are proposed to address this necessity,\ndemonstrating balanced proficiencies in both domains, unlike existing\nopen-source models that tend to specialize in either. Through meticulous pretraining\nusing a code-intensive corpus and instruction fine-tuning on text and code\ndata, our models achieve state-of-the-art averaged performance across diverse\ntext and coding benchmarks. Comprehensive experiments demonstrate Lemur’s\nsuperiority over existing open-source models and its proficiency across various\nagent tasks involving human communication, tool usage, and interaction under\nfully- and partially- observable environments. The harmonization between natural\nand programming languages enables Lemur-Chat to significantly narrow the\ngap with proprietary models on agent abilities, providing key insights into developing\nadvanced open-source agents adept at reasoning, planning, and operating\nseamlessly across environments. Our model and code have been open-sourced at\nhttps://github.com/OpenLemur/Lemur.'}",https://openreview.net{'value': '/pdf/8ef62990871ebf2cac77dc6ea498085f167f070a.pdf'},{'title_filter': 'Agent'},ICLR.cc,2024,Conference
https://openreview.net/forum?id=Z59Rb5bPPP,{'value': 'Trajeglish: Traffic Modeling as Next-Token Prediction'},"{'value': ['self-driving', 'traffic modeling', 'autonomous vehicles', 'simulation', 'motion prediction', 'transformer']}","{'value': 'A longstanding challenge for self-driving development is simulating dynamic driving scenarios seeded from recorded driving logs. In pursuit of this functionality, we apply tools from discrete sequence modeling to model how vehicles, pedestrians and cyclists interact in driving scenarios. Using a simple data-driven tokenization scheme, we discretize trajectories to centimeter-level resolution using a small vocabulary. We then model the multi-agent sequence of discrete motion tokens with a GPT-like encoder-decoder that is autoregressive in time and takes into account intra-timestep interaction between agents. Scenarios sampled from our model exhibit state-of-the-art realism; our model tops the Waymo Sim Agents Benchmark, surpassing prior work along the realism meta metric by 3.3% and along the interaction metric by 9.9%. We ablate our modeling choices in full autonomy and partial autonomy settings, and show that the representations learned by our model can quickly be adapted to improve performance on nuScenes. We additionally evaluate the scalability of our model with respect to parameter count and dataset size, and use density estimates from our model to quantify the saliency of context length and intra-timestep interaction for the traffic modeling task.'}",https://openreview.net{'value': '/pdf/6a1754e5443464338e361380403b4fec2f5d94b2.pdf'},{'abstract_filter': 'Agent'},ICLR.cc,2024,Conference
https://openreview.net/forum?id=W3VsHuga3j,{'value': 'Modeling Boundedly Rational Agents with Latent Inference Budgets'},"{'value': ['neurosymbolic', 'planning', 'rationality']}","{'value': 'We study the problem of modeling a population of agents pursuing unknown goals subject to unknown computational constraints. In standard models of bounded rationality, sub-optimal decision-making is simulated by adding homoscedastic noise to optimal decisions rather than actually simulating constrained inference. In this work, we introduce a latent inference budget model (L-IBM) that models these constraints explicitly, via a latent variable (inferred jointly with a model of agents’ goals) that controls the runtime of an iterative inference algorithm. L-IBMs make it possible to learn agent models using data from diverse populations of suboptimal actors. In three modeling tasks—inferring navigation goals from routes, inferring communicative intents from human utterances, and predicting next moves in human chess games—we show that L-IBMs match or outperforms Boltzmann models of decision-making under uncertainty. Moreover, the inferred inference budgets are themselves meaningful, efficient to compute, and correlated with measures of player skill, partner skill and task difficulty.'}",https://openreview.net{'value': '/pdf/b6fcabc7a4521fa9b8ff72f6d09fbafc1e118951.pdf'},{'title_filter': 'Agent'},ICLR.cc,2024,Conference
